title,author,score,upvote_ratio,num_comments,created_utc,url,permalink,selftext,flair,is_video,over_18,gilded,domain,post_id
New to /r/Bogleheads? Read this first!,Xexanoth,293,0.98,28,2025-06-08 14:28:20,https://www.reddit.com/r/Bogleheads/comments/1l6j6tj/new_to_rbogleheads_read_this_first/,https://www.reddit.com/r/Bogleheads/comments/1l6j6tj/new_to_rbogleheads_read_this_first/,"Welcome! Please consider exploring these resources to help you get started on your passive investing journey:

1. [Bogleheads wiki](https://www.bogleheads.org/wiki/)
2. [r/Bogleheads resources / featured links](https://www.reddit.com/r/Bogleheads/about/) (below sub rules)
3. [r/personalfinance wiki](https://www.reddit.com/r/personalfinance/wiki/index/)
4. [If You Can: How Young People Can Get Rich Slowly](http://efficientfrontier.com/ef/0adhoc/ifyoucan.pdf) (PDF booklet)
5. [Bogleheads Universit",Articles &amp; Resources,False,False,0,self.Bogleheads,1l6j6tj
"You should ignore the noise regarding tariffs and (geo)politics and just stay the course. But for some, this may be a wake-up call as to why diversification is so important.",Kashmir79,1361,0.97,400,2025-02-01 14:38:18,https://www.reddit.com/r/Bogleheads/comments/1ifee6q/you_should_ignore_the_noise_regarding_tariffs_and/,https://www.reddit.com/r/Bogleheads/comments/1ifee6q/you_should_ignore_the_noise_regarding_tariffs_and/,"It’s been building for weeks but today I woke up to every investing sub on reddit flooded with concerns about what tariffs are going to do to the stock market. Some folks are so worked up that they are indulging fears that this may bring about the collapse of America and/or the global economy and speculating about how they should best respond by repositioning their investments. I don’t want to trivialize the gravity of current events, but that is exactly the kind of fear-based reaction that lead",,False,False,0,self.Bogleheads,1ifee6q
Everyone feels like Buffet in a bull run,Smudgie666,195,0.93,67,2025-09-13 18:24:53,https://www.reddit.com/r/Bogleheads/comments/1ngakjw/everyone_feels_like_buffet_in_a_bull_run/,https://www.reddit.com/r/Bogleheads/comments/1ngakjw/everyone_feels_like_buffet_in_a_bull_run/,"Hi guys. Longtime lurker. First time poster. r/Bogleheads is what I consider to be my core investment philosophy and I’m now at the stage of asking - what would a Boglehead do before every investment decision. I’m basically one of those VT and chill guys. 

However, the market is experiencing a bit of a moment rn. I’ve noticed on other investment subs which I certainly don’t follow but for some reason see on my homepage that a lot of people are starting to post interesting and also dubious looki",Investment Theory,False,False,0,self.Bogleheads,1ngakjw
Constantly checking net worth,Accurate_Tie1861,229,0.93,82,2025-09-13 16:35:24,https://www.reddit.com/r/Bogleheads/comments/1ng81zw/constantly_checking_net_worth/,https://www.reddit.com/r/Bogleheads/comments/1ng81zw/constantly_checking_net_worth/,"Earlier this year I entered the 100K club and it felt pretty decent. My accounts’ growth is now enough to cover my basic food needs. It’s a psychological threshold I can record on my list to look back at when I feel depressed.

But lately I’ve started obsessing over my net worth and future projections. At random times during the day I feel the urge to pop out the calculator and run the same scenarios: how much I’d have in X years with Y salary, how much if I stopped contributing completely, or h",,False,False,0,self.Bogleheads,1ng81zw
$387k  looking to invest with a 15-year horizon.,Alive-Basis2307,2,0.67,1,2025-09-14 07:04:52,/r/FinancialPlanning/comments/1ngofjj/387k_looking_to_invest_with_a_15year_horizon/,https://www.reddit.com/r/Bogleheads/comments/1ngofu6/387k_looking_to_invest_with_a_15year_horizon/,,,False,False,0,,1ngofu6
Help me help my 80yo mother in law?,chuckEsIeaze,20,0.89,32,2025-09-13 16:01:20,https://www.reddit.com/r/Bogleheads/comments/1ng78u6/help_me_help_my_80yo_mother_in_law/,https://www.reddit.com/r/Bogleheads/comments/1ng78u6/help_me_help_my_80yo_mother_in_law/,"My mom is 80 and in good health. She has more than enough money to last, and also owns two rental properties that generate ~$40-60k year, + ~$3700/mo social security and ~$8k/Month RMDs. One of the rental properties carries a $120k mortgage at ~5.5% interest. 

She is not a spendthrift and doesn’t spend the money she takes in every year. But she is concerned her account isn’t conservative enough and has asked me (a committed if not perfect Boglehead) to offer suggestions. 

Total assets at Vangu",,False,False,0,self.Bogleheads,1ng78u6
VTI / VXUS Ratio,Important_Musician97,25,0.96,14,2025-09-13 15:15:38,https://www.reddit.com/r/Bogleheads/comments/1ng65dl/vti_vxus_ratio/,https://www.reddit.com/r/Bogleheads/comments/1ng65dl/vti_vxus_ratio/,"Hey all,

I was wondering if I should rebalance my 60/40 VTI/VXUS ratio in my brokerage account to another one, or do I just just chill? To be blunt, I saw that ratio somewhere in this sub and kept it ever since lol. 

My IRA however just has 100% VT, and I do not think I will be changing that anytime soon or ever.",Investing Questions,False,False,0,self.Bogleheads,1ng65dl
Taxes from Investments,MojoTronton,1,1.0,0,2025-09-14 08:12:05,/r/HongKong/comments/1ngplgy/taxes_from_investments/,https://www.reddit.com/r/Bogleheads/comments/1ngppiu/taxes_from_investments/,,,False,False,0,,1ngppiu
Should I reallocate in my Roth?,BromarWolf,9,0.85,15,2025-09-13 18:56:22,https://www.reddit.com/r/Bogleheads/comments/1ngb9vr/should_i_reallocate_in_my_roth/,https://www.reddit.com/r/Bogleheads/comments/1ngb9vr/should_i_reallocate_in_my_roth/,"Started investing in my Roth 2 years ago had no idea what I was doing. 


Currently hold 25.9% FBGRX and 74.09% FXAIX. 


Should I sell everything and just do VT or keep what I have and buy FTIHX? 


Also should I just mirror my investments in my brokerage once I start one? ",Portfolio Review,False,False,0,self.Bogleheads,1ngb9vr
How are you protecting investments against mental decline?,Red-Pill1218,8,0.9,5,2025-09-13 19:49:38,https://www.reddit.com/r/Bogleheads/comments/1ngcfaq/how_are_you_protecting_investments_against_mental/,https://www.reddit.com/r/Bogleheads/comments/1ngcfaq/how_are_you_protecting_investments_against_mental/,"My mother, now 90, moved in a couple of years ago and her mental decline has been very apparent. When she moved in, she was on her computer daily, writing her life story. Two years later, we just shut her computer down for good rather than upgrade it to Windows 11 because she's so confused when she uses it. 

I'm projecting ahead and thinking that if I live that long, I wouldn't trust myself to manage my own investments at that age, even though I don't manage them now (I'm 70/30, set it and forg",,False,False,0,self.Bogleheads,1ngcfaq
Active ETF in 401k-like vs VXUS in taxable account,dicktorstranger,2,0.75,0,2025-09-14 02:32:55,https://www.reddit.com/r/Bogleheads/comments/1ngjxtn/active_etf_in_401klike_vs_vxus_in_taxable_account/,https://www.reddit.com/r/Bogleheads/comments/1ngjxtn/active_etf_in_401klike_vs_vxus_in_taxable_account/,"I’m in S.Korea. No I’m 28 yrs old. And I would like to buy house in 3 years with 70% of the mortgage. I’m investing my money to use as pension after retirement.

S.Korea law:
- In taxable account, 2k$ of revenue is tax-free and the excess is 22% taxed.
- Personal pension accounts are 401k-like plan. All of the capital gains and dividends are tax-free until you withdraw. The withdraw tax rate is 4.4%

My portfolio:
- savings bank account (cash-like, 50%)
- Nasdaq100 ETF (401k-like, 25%)
- S&amp;P",Non-US Investors,False,False,0,self.Bogleheads,1ngjxtn
Is it ok to bee 100% invested in market index in retirement?,Sandy_NSFW_,54,0.8,108,2025-09-13 07:30:51,https://www.reddit.com/r/Bogleheads/comments/1nfv5pm/is_it_ok_to_bee_100_invested_in_market_index_in/,https://www.reddit.com/r/Bogleheads/comments/1nfv5pm/is_it_ok_to_bee_100_invested_in_market_index_in/,"I am 60 years old with 2 young teens, I am early retired and live off my investments (I will touch a small pension in 5 years). House fully paid (value 1/2 milion, which we are planning to sell in 8 years), car fully paid. 1.1 m invested in world index funds (TDIV, FGQI, SWDA, VWRD, IDVO, DIVO, JEPQ).
Am I crazy, and should I put 20-30-40% into bonds? As I see it, bonds don't pay enough to make it a useful investment. Even if the market drops by 20-30% for a year or 2 or 3 we still have enough m",,False,False,0,self.Bogleheads,1nfv5pm
Should I just keep buying VTI until I retire?,abel135x,398,0.81,89,2025-09-12 20:46:22,https://i.redd.it/qa82x361xtof1.jpeg,https://www.reddit.com/r/Bogleheads/comments/1nfjxon/should_i_just_keep_buying_vti_until_i_retire/,Maxed out Rota IRA with VTI and individual account is 1k reoccurring investment every payday with VTI as well. Should I just keep doing this until I retire or pick some more risky stocks for a bigger profit in the future?,Investing Questions,False,False,0,i.redd.it,1nfjxon
5% yield money market fund,Fantastic-Ad-9100,27,0.7,82,2025-09-13 11:26:16,https://www.reddit.com/r/Bogleheads/comments/1ng0bia/5_yield_money_market_fund/,https://www.reddit.com/r/Bogleheads/comments/1ng0bia/5_yield_money_market_fund/,Hi I was approached by a financial advisor who says they have a fidelity money market fund that’s been getting 5% for the last 2 years. There’s no interest fees or even tax on the growth they say. I have to sign up thru their company to get it. My question is is this too good to be true and why isn’t everyone doing this? I don’t have to pay the advisor according to them. Any help would be appreciated. ,,False,False,0,self.Bogleheads,1ng0bia
What Money Market Fund To Buy?,Sandy_NSFW_,1,1.0,0,2025-09-14 03:49:22,https://www.reddit.com/r/Bogleheads/comments/1ngl7zl/what_money_market_fund_to_buy/,https://www.reddit.com/r/Bogleheads/comments/1ngl7zl/what_money_market_fund_to_buy/,"Following the feedbacks I had to an earlier question on this forum (thank you very much for all the very useful replies!!), I have decided to put 3-4 years of ""emergency, if-the-market-crashes"" funds in the money market (Euro only).   
I have shortlisted the following three: SMART, XEON, LEONIA (all with synthetic replication, swap-based?), and YCSH (with physical replication?).   
Should I worry about the fact that the first three use derivatives, in case of market crash?  
Any other advise or ",Investing Questions,False,False,0,self.Bogleheads,1ngl7zl
Vanguard is voting about making VHT non-diversified,plartoo,16,0.81,15,2025-09-13 11:21:18,https://www.reddit.com/r/Bogleheads/comments/1ng0717/vanguard_is_voting_about_making_vht_nondiversified/,https://www.reddit.com/r/Bogleheads/comments/1ng0717/vanguard_is_voting_about_making_vht_nondiversified/,"As the title said, I received email to vote in a special meeting about making VHT non-diversified. The summary (see the detail at the end of this post) is that they want to invest more than 5% of the fund's assets into some companies (making it track closer to the actual market in healthcare). 

Not exactly sure how I feel about it, but I worry that some of the big companies will take up a huge portion of the fund's portfolio (that's good if these big companies are doing great, but risk increase",Investing Questions,False,False,0,self.Bogleheads,1ng0717
Solo 401K to SEP IRA questions,pftossitaway,4,0.84,3,2025-09-13 17:24:06,https://www.reddit.com/r/Bogleheads/comments/1ng96iv/solo_401k_to_sep_ira_questions/,https://www.reddit.com/r/Bogleheads/comments/1ng96iv/solo_401k_to_sep_ira_questions/,"My wife current is self employed but has hired a part time employee (16 hours a week) who is coming up on 1 year of part time employment. She has had a Solo 401K for the past few years but with this part time employee who is W-2 I believe she no longer can have this plan. 

We're looking into other plan options so she can continue contributing to her retirement. Is a SEP-IRA her best bet? 

1. At what moment can she no longer contribute to the Solo 401K? Was it the moment she hired the part time",Investing Questions,False,False,0,self.Bogleheads,1ng96iv
"People Who Liquidated Their Retirement Accounts In April, How Are You Feeling Now?",TimothyOfficially,498,0.8,517,2025-09-12 14:51:03,https://www.reddit.com/r/Bogleheads/comments/1nfbg0q/people_who_liquidated_their_retirement_accounts/,https://www.reddit.com/r/Bogleheads/comments/1nfbg0q/people_who_liquidated_their_retirement_accounts/,"In April, equities dropped sharply and many of you posted on the Boglehead subreddit that ""This time it's different"" and ""I liquidated my retirement accounts"" to cut your losses.

What ever happened to you? What are you doing now? How do you feel?",,False,False,0,self.Bogleheads,1nfbg0q
New Brokerage Acct- Taxable vs Roth,Then-Anywhere4453,4,0.84,4,2025-09-13 15:48:05,https://www.reddit.com/r/Bogleheads/comments/1ng6xic/new_brokerage_acct_taxable_vs_roth/,https://www.reddit.com/r/Bogleheads/comments/1ng6xic/new_brokerage_acct_taxable_vs_roth/,"I have a taxable brokerage account that I opened beginning of the year-

FSKAX 60% / FTIHX 20%/ FXNAX 20%

Had been contributing a small sum monthly before I lost my job- then stopped auto transfers.

Considering dumping some cash I came into recently and heard its wise to open a Roth IRA in the brokerage and contribute the max to that first.

Have a trad IRA separately that I haven’t made a contribution to this year yet, so seems like I am free to open Roth and deposit there.

What funds do you",Investing Questions,False,False,0,self.Bogleheads,1ng6xic
Live off brokerage to invest salary in 403b and 457b?,Correction-Course,3,1.0,0,2025-09-13 18:31:56,/r/Fire/comments/1nga6im/live_off_brokerage_to_invest_salary_in_403b_and/,https://www.reddit.com/r/Bogleheads/comments/1ngaqcb/live_off_brokerage_to_invest_salary_in_403b_and/,,,False,False,0,,1ngaqcb
Why is it recommended to consolidate multiple similar index funds?,Sweet_Education6823,12,0.7,23,2025-09-13 09:57:52,https://www.reddit.com/r/Bogleheads/comments/1nfy65i/why_is_it_recommended_to_consolidate_multiple/,https://www.reddit.com/r/Bogleheads/comments/1nfy65i/why_is_it_recommended_to_consolidate_multiple/,"I get that there’s a lot of redundancy, but is there a downside to it ",,False,False,0,self.Bogleheads,1nfy65i
Advice request:  Roth conversion or Stock sale with increased standard deduction for 2025.,Glass-Cheek4480,1,1.0,0,2025-09-13 21:39:13,https://www.reddit.com/r/Bogleheads/comments/1ngenau/advice_request_roth_conversion_or_stock_sale_with/,https://www.reddit.com/r/Bogleheads/comments/1ngenau/advice_request_roth_conversion_or_stock_sale_with/,"With the increased standard deduction for 65+ seniors, I'd like to take advantage of this.  First some details:  I'm 71, so not quite at RMD but close.  No earned income, but some interest and dividend income (about $7k).  Small pension ($2k), Small SSI ($18.5k).  I have a stock account (long term) of about $130k with a cost basis of about $77k, A personal IRA of about $150k, a 401k of about $60k, and a Roth of about $30k.  I also have a short term stock account of $35k that will be long term be",,False,False,0,self.Bogleheads,1ngenau
Moving from Thrivent to Fidelity,montanagamer,1,0.6,8,2025-09-13 21:02:03,https://www.reddit.com/r/Bogleheads/comments/1ngdwls/moving_from_thrivent_to_fidelity/,https://www.reddit.com/r/Bogleheads/comments/1ngdwls/moving_from_thrivent_to_fidelity/,"I am doing a rollover to Fidelity to stop bleeding wealth to a high expense ratio at Thrivent for my Roth IRA.

I am 30 with only about 17k in investments. I have a high risk tolerance as I am working towards a pension by 58. I make right under 60k with HHI of over 140k which should go up to about to 180-200k in the next 2 years. Monthly spend is only about 4.2k including mortgage. Obviously wanting to increase money towards investments and less saving as we have a large emergency fund built bac",Investing Questions,False,False,0,self.Bogleheads,1ngdwls
"Newb Q: For ""set it and forget it"" do I have to make sure I have any settings enabled?",twistyxo,2,0.67,10,2025-09-13 11:07:22,https://www.reddit.com/r/Bogleheads/comments/1nfzu9l/newb_q_for_set_it_and_forget_it_do_i_have_to_make/,https://www.reddit.com/r/Bogleheads/comments/1nfzu9l/newb_q_for_set_it_and_forget_it_do_i_have_to_make/,Vanguard user. I just put money into three fund portfolio and log out. But do I have to make sure I have any specific settings enabled to ensure the growth does its thing? ,Investing Questions,False,False,0,self.Bogleheads,1nfzu9l
Cash fund,Relaxandeasy,4,0.83,22,2025-09-13 10:22:24,https://www.reddit.com/r/Bogleheads/comments/1nfyqsp/cash_fund/,https://www.reddit.com/r/Bogleheads/comments/1nfyqsp/cash_fund/,"VMFXX is giving 4.2% yield, better than Marcus for example. This could be a good parking space for surplus cash. Any thoughts ?",,False,False,0,self.Bogleheads,1nfyqsp
Modeling move to another state. Help.,Index7756,0,0.5,0,2025-09-13 16:55:22,/r/Boldin/comments/1ndhuke/modeling_move_to_another_state_help/,https://www.reddit.com/r/Bogleheads/comments/1ng8irt/modeling_move_to_another_state_help/,,,False,False,0,,1ng8irt
Pay Student Loan or Invest,Effective-Magician11,1,1.0,8,2025-09-13 16:44:04,https://www.reddit.com/r/Bogleheads/comments/1ng89dm/pay_student_loan_or_invest/,https://www.reddit.com/r/Bogleheads/comments/1ng89dm/pay_student_loan_or_invest/,"I’m 29 years old with a 59k private student loan @ 6.8% $729 a month. I have 12k in savings, 2k in a brokerage account, and 90k retirement in my TSP. Should I prioritize paying off the loan soon as possible or pay the minimum and invest in the market?",,False,False,0,self.Bogleheads,1ng89dm
23 - hoping to retire before 40,checkmatee88,0,0.3,3,2025-09-14 01:02:58,https://i.redd.it/gsf7wf0qb2pf1.jpeg,https://www.reddit.com/r/Bogleheads/comments/1ngifyr/23_hoping_to_retire_before_40/,"I believe in US dominance going forward so have no need for international. 

Currently contributing 6k a month doing a 70/20/10 split between voo/qqq/fbtc

Thoughts on my portfolio? Fbtc is a little side bet will only take up 10% of my portfolio ",,False,False,0,i.redd.it,1ngifyr
VUSXX vs HYSA,Both-Statistician179,1,0.6,5,2025-09-13 15:08:00,https://www.reddit.com/r/Bogleheads/comments/1ng5ypq/vusxx_vs_hysa/,https://www.reddit.com/r/Bogleheads/comments/1ng5ypq/vusxx_vs_hysa/,"I am retired and live in NC w 4.25% state tax. Is it better to park my available cash (25-90k) in a 4%HYSA or in VUSXX? I have a 4% Wealthfront HYSA now but reading about VUSXX makes me question the HYSA. 
I also have a small taxable Vanguard 3 fund portfolio (VTSAX, VTIAX, VBTLX) doing spectacularly well in addition to my IRA which I let a professional manage. ",,False,False,0,self.Bogleheads,1ng5ypq
401k Up to Match?,Knights_12,12,0.8,13,2025-09-13 00:11:54,https://www.reddit.com/r/Bogleheads/comments/1nfny8i/401k_up_to_match/,https://www.reddit.com/r/Bogleheads/comments/1nfny8i/401k_up_to_match/,"Please help as I have read conflicting guidance/ rules of thumb on here. Is the Boglehead principle for work retirement is contribute to one's 401k but only up to the company match? Then direct one's remaining monthly income into other vehicles like IRA/ Roth IRA, general savings, taxable investment account etc.
For context, I work at a large company and they offer $1 match for every $1 contributed, but only up to 6% of income pre-tax per paycheck...🧐📚💵📈📉",,False,False,0,self.Bogleheads,1nfny8i
"22 (turning 23), just started my first finance role — feel behind with only £900 saved. How do I set myself up right?",Visible_Mango8727,1,1.0,1,2025-09-13 12:58:59,/r/UKJobs/comments/1nfz16d/22_turning_23_just_started_my_first_finance_role/,https://www.reddit.com/r/Bogleheads/comments/1ng2mue/22_turning_23_just_started_my_first_finance_role/,,,False,False,0,,1ng2mue
Is 70% VTI and 30% VSUX a good asset allocation mix?,Big_Seat2545,55,0.89,47,2025-09-12 15:18:11,https://www.reddit.com/r/Bogleheads/comments/1nfc58s/is_70_vti_and_30_vsux_a_good_asset_allocation_mix/,https://www.reddit.com/r/Bogleheads/comments/1nfc58s/is_70_vti_and_30_vsux_a_good_asset_allocation_mix/,"I'm in my late 20s and don't need this money anytime soon.  I already have savings etc.  Is this a good asset allocation mix? I don't know much about investing but this is what I came up with from reading this sub.  I might add 10% bonds, like BND, in the future, but right now I can afford to be aggressive, within reason, and hopefully I am not taking uncompensated risk.",,False,False,0,self.Bogleheads,1nfc58s
add small cap...,Extension_Ask_5440,1,0.6,17,2025-09-13 11:58:36,https://www.reddit.com/r/Bogleheads/comments/1ng149d/add_small_cap/,https://www.reddit.com/r/Bogleheads/comments/1ng149d/add_small_cap/,"upon Rollover to an IRA from my work 401k - plan would be to move to VTI, VXUS, BND.  Some recent information via a reputable podcaster imply to look into putting some small cap value for a possible upside tweak to returns, yes more volatility - but over the long run, it seems to be backtested that this could be a possible thing to do.  My long run consists of accumulating for the next 8-9 or so years, then glidepath to a more conservative mix in full retirement.   What's the opinion on whether ",,False,False,0,self.Bogleheads,1ng149d
Is this feasible for the long run,clickersforeal,0,0.43,3,2025-09-13 11:26:29,https://i.redd.it/zxm5h4y1ayof1.jpeg,https://www.reddit.com/r/Bogleheads/comments/1ng0boz/is_this_feasible_for_the_long_run/,"25m just opened Roth IRA a couple days ago and deposited $2,000 (wish I was exposed to this sooner but oh well). Planning to max every year from now on. Are my allocations okay ? (70/20/10) should I get rid of bonds till say my 30’s ? Should I have an etf ? So many questions honestly. any feedback would be appreciated. (Total newb) ",,False,False,0,i.redd.it,1ng0boz
Crossed another milestone (5M) and planning for my spouse to quit her job. I feel like my after tax holdings are overcomplicated and would like some advice on simplifying them.,Bogglethowaway,0,0.44,8,2025-09-13 18:10:39,https://www.reddit.com/r/Bogleheads/comments/1nga8uo/crossed_another_milestone_5m_and_planning_for_my/,https://www.reddit.com/r/Bogleheads/comments/1nga8uo/crossed_another_milestone_5m_and_planning_for_my/,"

Holding | Total | Notes
---|---|----
2045 Retirement | 546.5K | MBR
M1 Finance | ~173.5K | 42% VTI, 24% VEA, 14% AVUV, 12% VWO, 8% AVDV
Vanguard Advisor | 464K | Meh
Vanguard Self Directed | 718.5K | 97% VTWAX, 3% VTSAX
E*TRADE | 60.K | 34.8% MSFT, 21.9% VTSAX, 21.2% VTWAX, 10.5% VOO
Fundrise | 144.5K | Meh
AAPL (ESPP) | 315.5K | Held for years, my cost basis is $2.12
GOOG | 633K | Average cost basis ~$110
Betterment (90% core) | 1.35M | No note
Bettement (40% Stocks) | 4.2K | No note
HSA | 50",,False,False,0,self.Bogleheads,1nga8uo
Salutations!,DragMaterial,16,0.92,22,2025-09-12 19:22:51,https://www.reddit.com/r/Bogleheads/comments/1nfi5tg/salutations/,https://www.reddit.com/r/Bogleheads/comments/1nfi5tg/salutations/,"Hello Everyone, 

So I just recently decided to start investing for my retirement at the ripe old age of 40. I wished I had listened to the old-timers when I was young encouraging me to save and invest, but nonetheless, here I am. I've started an ACH transfer of $50 to my Roth IRA account through Fidelity Investments (bi-weekly) and plan to invest in Fidelity's Zero Total Market Index Fund, and their Zero International Index Fund (buying a share of each biweekly with the remainder going towards ",,False,False,0,self.Bogleheads,1nfi5tg
Mature Child Trust Fund,LordVoluptuous,2,0.75,11,2025-09-13 06:31:46,https://www.reddit.com/r/Bogleheads/comments/1nfu5ss/mature_child_trust_fund/,https://www.reddit.com/r/Bogleheads/comments/1nfu5ss/mature_child_trust_fund/,"I've recently gained access to my Child Trust Fund, which is a managed fund with roughly 55% of the money invested in stocks, 5% in bonds and the majority of the rest in ""other fixed income"". 

I've read through the ""Investing from the UK"" boglehead wiki page and would really appreciate any advice on whether transferring the money from my CTF to a S&amp;S ISA with Vanguard and then following the wiki page's sample portfolio format young investor makes the most sense.

Thank you!",Non-US Investors,False,False,0,self.Bogleheads,1nfu5ss
Delays in direct deposit into vanguard brokerage account?,FaultNo5255,1,0.67,5,2025-09-13 07:45:23,https://www.reddit.com/r/Bogleheads/comments/1nfvf0b/delays_in_direct_deposit_into_vanguard_brokerage/,https://www.reddit.com/r/Bogleheads/comments/1nfvf0b/delays_in_direct_deposit_into_vanguard_brokerage/,"Hi all, I tried setting up a direct deposit from my employer into a brokerage account in Vanguard. My direct deposit date was Friday, and I received partial direct deposits to my other linked accounts with other banks, but not with Vanguard. Is this delay typical? ",,False,False,0,self.Bogleheads,1nfvf0b
Is it safe to have 100% market index until 7 years to retirement?,raphiredgi,346,0.93,163,2025-09-11 22:27:38,https://i.redd.it/ldyymlq6anof1.jpeg,https://www.reddit.com/r/Bogleheads/comments/1nerkl5/is_it_safe_to_have_100_market_index_until_7_years/,"
",Portfolio Review,False,False,0,i.redd.it,1nerkl5
403b rollover to IRA,LobsterDazzling6330,3,1.0,2,2025-09-12 23:09:36,/r/personalfinance/comments/1nfmqxt/403b_rollover_to_ira/,https://www.reddit.com/r/Bogleheads/comments/1nfms3w/403b_rollover_to_ira/,,,False,False,0,,1nfms3w
