title,author,score,upvote_ratio,num_comments,created_utc,url,permalink,selftext,flair,is_video,over_18,gilded,domain,post_id
What happens if employment doesn’t improve at all after the rate cuts?,AppropriateRefuse590,330,0.88,226,2025-09-11 20:14:25,https://www.reddit.com/r/investing/comments/1neov7x/what_happens_if_employment_doesnt_improve_at_all/,https://www.reddit.com/r/investing/comments/1neov7x/what_happens_if_employment_doesnt_improve_at_all/,"I can’t figure out why a 0.25% or 0.5% rate cut would be enough for companies to believe that America’s future looks bright enough to invest and plan ahead with certainty.

Up to now, Trump has kept using all kinds of tactics that make people less and less confident about investing.

Just look at the recent news he easily destroyed South Korea’s willingness to invest.

So what about next time?

A 0.25% or 0.5% rate cut is no match for just holding on to cash to guard against Trump wrecking thing",,False,False,0,self.investing,1neov7x
Unrealized long term gain vs Realized short term gain,FrankMartinTransport,0,0.14,15,2025-09-13 11:52:14,https://www.reddit.com/r/investing/comments/1ng0ymd/unrealized_long_term_gain_vs_realized_short_term/,https://www.reddit.com/r/investing/comments/1ng0ymd/unrealized_long_term_gain_vs_realized_short_term/,"I bought 50 shares of a stock at $46.93 on 25 Aug 2025 which is now at $48.30. During this period I sold and bought this stock several times to earn a profit of $37.5. Had I just kept on holding, I would have earned $68.5 profit.  

But then this $68.5 is unrealized gain while $37.5 is realized gain aka hard cash so I am in a dilemma.  

Statistically speaking, is it better to hold a stock or to keep on trading it daily to earn higher profit?",,False,False,0,self.investing,1ng0ymd
Why does the app have to be so annoying?,EatAPeach2023,0,0.33,16,2025-09-13 11:48:52,https://www.reddit.com/r/investing/comments/1ng0vl1/why_does_the_app_have_to_be_so_annoying/,https://www.reddit.com/r/investing/comments/1ng0vl1/why_does_the_app_have_to_be_so_annoying/,"Been on Robinhood for years but always used it pretty sporadically. Recently I moved a chunk of money over because I saw the IRA bonus and I actually thought I could put crypto in the IRA (you can't btw). I did get the match so it all bad and I paid for the Gold membership or whatever it's called. 

Now every time I go on the app I get pounded with the damn ads. It's driving me nuts! Now I'm looking at pulling my money off and putting it back in Schwab. 

Am I the only one who is getting driven ",,False,False,0,self.investing,1ng0vl1
"If Someone Gave You $2 Million Today, How Would You Invest It? Property vs Shares",shanewzR,39,0.68,258,2025-09-12 01:05:50,https://www.reddit.com/r/investing/comments/1neuj1c/if_someone_gave_you_2_million_today_how_would_you/,https://www.reddit.com/r/investing/comments/1neuj1c/if_someone_gave_you_2_million_today_how_would_you/,"Help me with your view on this debate I have with a friend. If you have $2m today, whats the bath path to **most wealth** over a **30 year period**?

1. **Invest in Property (Residential or Commercial)** \- assuming a net yield of 6% with inflation aligned rental increases (say 2% pa). Also assuming 50% borrowing and the rest the $2m cash (so property portfolio would be $4m worth)
2. **Invest in an ETF (S&amp;P500, Nasdaq or Total World)** \- assuming a 9% return pa avg

What would you do?",,False,False,0,self.investing,1neuj1c
Question on investing gold 24y/o,Ok-End-3213,0,0.31,41,2025-09-13 03:15:09,https://www.reddit.com/r/investing/comments/1nfr2pc/question_on_investing_gold_24yo/,https://www.reddit.com/r/investing/comments/1nfr2pc/question_on_investing_gold_24yo/,"I have the opportunity to buy gold at a nice price, slightly below market value. This would be buying coins. My investments so far are stock, etf and index funds, emergency fund etc.

I know gold is an inflation hedge and doesn't have crazy growth potential like some stocks. Is it a worthwhile investment to buy a couple oz's and hold for the next decade or so?

Let me know! Thanks!",,False,False,0,self.investing,1nfr2pc
Is there a stock you think is undervalued now or might be soon?,Realistts,7,0.57,99,2025-09-12 10:00:58,https://www.reddit.com/r/investing/comments/1nf41l6/is_there_a_stock_you_think_is_undervalued_now_or/,https://www.reddit.com/r/investing/comments/1nf41l6/is_there_a_stock_you_think_is_undervalued_now_or/,"The big tech names have been super volatile lately, so I’m thinking it might be time to look for stocks that are still undervalued. I'd appreciate some mentions of stocks that are still flying under the radar but have a lot of room to grow in the future. I have been eyeing PLTR, LMT and some space stocks, would love to hear your thoughts.",,False,False,0,self.investing,1nf41l6
"Fed Cut Odds 99% for 25bps: Economy Boost or Volatility Trap, Your Hedging Pains? ​",Narrow_Chance7639,26,0.82,65,2025-09-12 00:53:54,https://www.reddit.com/r/investing/comments/1neubqw/fed_cut_odds_99_for_25bps_economy_boost_or/,https://www.reddit.com/r/investing/comments/1neubqw/fed_cut_odds_99_for_25bps_economy_boost_or/,"Discussing general economy trends: Fed's 99% odds for 25bps cut in September could ease pressures but trigger volatility (jobs revisions show 300K fewer). No promo, just insights.

What's a hedging pain in this setup, like costs? Share tactics for navigation. We've been thinking about this a lot.",,False,False,0,self.investing,1neubqw
Why is the potential ban of pfof firms no longer a major concern for $hood?,MentalCaptain7033,5,0.63,2,2025-09-12 09:34:35,https://www.reddit.com/r/investing/comments/1nf3erh/why_is_the_potential_ban_of_pfof_firms_no_longer/,https://www.reddit.com/r/investing/comments/1nf3erh/why_is_the_potential_ban_of_pfof_firms_no_longer/,"If we’re being honest they probably should be banned. That being said we already saw the massive hood crash the last time a potential market maker ban was considered. It feels like this should be a big underlying issue as selling orders is about 55% of their revenue (q2 numbers). I don’t see a future where Robinhood ceases to exist as they already have a massive customer base, but a 50% revenue drop would murder stock prices.",,False,False,0,self.investing,1nf3erh
What’s still a strong financial indicator for stock picking?,Cluelessjoint,27,0.85,44,2025-09-11 22:37:41,https://www.reddit.com/r/investing/comments/1ners2i/whats_still_a_strong_financial_indicator_for/,https://www.reddit.com/r/investing/comments/1ners2i/whats_still_a_strong_financial_indicator_for/,"I’ve heard from many that P/E is “useless” when evaluating stocks nowadays due to the high growth companies like Tech stocks that average 30+ price to earnings, what’s an indicator that you still think is still fairly good at depicting a company’s fair(ish) value?",,False,False,0,self.investing,1ners2i
Why does inflation being up mean that fed is more likely to cut rates?,apoptosis66,162,0.83,257,2025-09-11 12:19:05,https://www.reddit.com/r/investing/comments/1ned4kr/why_does_inflation_being_up_mean_that_fed_is_more/,https://www.reddit.com/r/investing/comments/1ned4kr/why_does_inflation_being_up_mean_that_fed_is_more/,"I get that the equities market wants to see a rate cut, but I don't understand why increased inflation means that the fed is ""more"" likely to cut.   Didn't we just go through a period where rising  inflation meant the fed should raise rates?  I mean looks like employment is getting bad too, but its not significantly higher.  Anyone care to explain?",,False,False,0,self.investing,1ned4kr
Kid savings acct- helpful?,searcherbee123,2,0.62,7,2025-09-12 11:52:42,https://www.reddit.com/r/investing/comments/1nf6vqk/kid_savings_acct_helpful/,https://www.reddit.com/r/investing/comments/1nf6vqk/kid_savings_acct_helpful/,"I’ve got a 529 for my 4 year old. We put in $250 a month and our financial planner told us we should up it to 400/500. Ok.
But I also have been putting $100 a month in a separate kid savings acct for her (capital one). It has almost 5k at this point and a 2.5% APY. Is there any benefit here or should I be putting this elsewhere with a higher rate of return? My thought was that this could be used for a car, down payment, traveling after college- something not education. ",,False,False,0,self.investing,1nf6vqk
Gold producers that are still flying under the radar?,Kind-Recover4939,3,0.58,9,2025-09-12 11:09:42,https://www.reddit.com/r/investing/comments/1nf5s7c/gold_producers_that_are_still_flying_under_the/,https://www.reddit.com/r/investing/comments/1nf5s7c/gold_producers_that_are_still_flying_under_the/,"Hi all, could you recommend me a few gold producers that are still trading at a lower price and have great potential for the future? I've got some of the more famous ones already, now I am adding newer producers in a hope for some nice outsized returns.


I am mostly looking for mid tier producers but I can consider everything.",,False,False,0,self.investing,1nf5s7c
Thinking of investing in mechanical engineering companies,Happy-Youth8497,0,0.38,8,2025-09-12 13:39:20,https://www.reddit.com/r/investing/comments/1nf9mo4/thinking_of_investing_in_mechanical_engineering/,https://www.reddit.com/r/investing/comments/1nf9mo4/thinking_of_investing_in_mechanical_engineering/,"Software has been booming in developments in the past decade, to the point where we know that in the future it will replace 90% of all work done through computers, but we're still unsure of physical labor workers, theres always a deficit in that.
I firmly believe thats the future we've yet to see, if you ask most STEM students they'll tell you mechanical engineering will be the new hot field over compsci (im a compsci student myself).
Though I haven't seen any promising companies that do that, a",,False,False,0,self.investing,1nf9mo4
Rolled over old Simple IRA and 401K into traditional IRA - ambassador discretionary and 1% fee common?,Acky1425,3,0.8,19,2025-09-12 07:29:27,https://www.reddit.com/r/investing/comments/1nf0o7h/rolled_over_old_simple_ira_and_401k_into/,https://www.reddit.com/r/investing/comments/1nf0o7h/rolled_over_old_simple_ira_and_401k_into/,"I recently rolled over an old Simple IRA and an old 401k plan that I had from previous employers into a traditional IRA.  The FA wants me to sign an ambassador discretionary which will allow him to buy/sale without my discretion and has a 1% annual fee.

I haven't paid into either of these accounts in years (since I left their respective employer), and won't be paying anything into them in the future.  I innately have a cautious mentality, so off the bat I have hesitations to allow an ambassador",,False,False,0,self.investing,1nf0o7h
Hedged with gold while benefiting from silver and copper: EMX Royalty,East_Elderberry5385,6,0.8,3,2025-09-12 03:00:17,https://www.reddit.com/r/investing/comments/1newcvy/hedged_with_gold_while_benefiting_from_silver_and/,https://www.reddit.com/r/investing/comments/1newcvy/hedged_with_gold_while_benefiting_from_silver_and/,"Hedged with gold royalties during rate cuts, while also benefiting from strong copper and silver prices in times of economic expansion, truly a cash cow.

A stock for eternity? For me, yes. I’m invested for the long term: gold provides downside protection, while copper and silver capture the upside in a recovery.

On top of that, the merger with Elemental Altus creates further synergies.

With no heavy costs for plants or large workforces, royalties are not capital-intensive, making this an exce",,False,False,0,self.investing,1newcvy
"What should me and my wife do with $72,000 we just made from selling our house?",YaBoiCade,37,0.69,111,2025-09-11 16:37:55,https://www.reddit.com/r/investing/comments/1nejwha/what_should_me_and_my_wife_do_with_72000_we_just/,https://www.reddit.com/r/investing/comments/1nejwha/what_should_me_and_my_wife_do_with_72000_we_just/,"Me and my wife just netted $72,000 by selling our old house. I’m trying to see if the plan we have worked out is solid or not.

$40,000 - paying off my wife’s $800+ car payment at a 9.5% interest rate (terrible decision, we weren’t as financially wise back then and we still owe too much on it to trade it in for something cheaper. With this payment and our second mortgage gone though we plan on investing heavily into ETFs, 401ks, and Roth IRAs with the extra disposable income) 

$10,000 - High yi",,False,False,0,self.investing,1nejwha
Now days do people pick stocks/ETFs/MF based on fundamentals or sentiment?,Ok_Atmosphere3601,0,0.5,6,2025-09-12 11:47:35,https://www.reddit.com/r/investing/comments/1nf6qxj/now_days_do_people_pick_stocksetfsmf_based_on/,https://www.reddit.com/r/investing/comments/1nf6qxj/now_days_do_people_pick_stocksetfsmf_based_on/,"I was always taught to primarily pick investments based on fundamentals like P/E ratio, debt ladders, dividend coverage etc.

But now it seems people primarily use sentiment based along the business model/area instead. 

Which do you use?

I understand that many people (including me for my retirement scheme) use broad based index funds. But even then you do have choices b/w large/mid/small/growth/value as well as sector funds.",,False,False,0,self.investing,1nf6qxj
"Daily General Discussion and Advice Thread - September 12, 2025",AutoModerator,4,1.0,45,2025-09-12 04:00:57,https://www.reddit.com/r/investing/comments/1nex9t2/daily_general_discussion_and_advice_thread/,https://www.reddit.com/r/investing/comments/1nex9t2/daily_general_discussion_and_advice_thread/,"Have a general question? Want to offer some commentary on markets? Maybe you would just like to throw out a neat fact that doesn't warrant a self post? Feel free to post here!

Please consider consulting our FAQ first - [https://www.reddit.com/r/investing/wiki/faq](https://www.reddit.com/r/investing/wiki/faq) And our [side bar](https://www.reddit.com/r/investing/about/sidebar) also has useful resources.

If you are new to investing - please refer to Wiki - [Getting Started](https://www.reddit.co",Daily Discussion,False,False,0,self.investing,1nex9t2
Average Daily Range (ADR) indicator,Enough_Ad4294,0,0.14,1,2025-09-12 18:56:10,https://www.reddit.com/r/investing/comments/1nfhk7y/average_daily_range_adr_indicator/,https://www.reddit.com/r/investing/comments/1nfhk7y/average_daily_range_adr_indicator/,"Anyone here use the Average Daily Range (ADR) indicator with hourly stats for Forex, crypto, metals or indices?

Does it actually help you time entries or avoid chasing stretched moves, or is it just another number on the chart?

I’ve been checking out the [ADR Tracker](https://apps.apple.com/us/app/adr-tracker/id6752336382) app, which shows today’s range vs the average and breaks it down by hour, but I’m mostly curious if the ADR approach itself is really useful.

What’s your take?",,False,False,0,self.investing,1nfhk7y
"Figure IPO flip success, now eyeing Gemini",Vodaynallkl,0,0.41,1,2025-09-12 10:48:45,https://www.reddit.com/r/investing/comments/1nf58zn/figure_ipo_flip_success_now_eyeing_gemini/,https://www.reddit.com/r/investing/comments/1nf58zn/figure_ipo_flip_success_now_eyeing_gemini/,"Looking forward to Gemini’s IPO today. Yesterday Figure shot up to $38 at the peak, soaring 50% at the top and closing the day up 24%. I flipped my 84 shares and it was such a nice surprise. Guess Gemini might perform even better tonight. did you guys subscribe? Planning to flip?",,False,False,0,self.investing,1nf58zn
has anyone tried recently released robin hood social,anasarca1,0,0.5,2,2025-09-12 10:38:31,https://www.reddit.com/r/investing/comments/1nf4znu/has_anyone_tried_recently_released_robin_hood/,https://www.reddit.com/r/investing/comments/1nf4znu/has_anyone_tried_recently_released_robin_hood/,"I realize that Robin Hood social has recently been released.   Has anyone tried it out, and what has been their experience?  How diverse are the topics of discussion......are they mainly discussing growth / momentum stocks?   Is there any discussion of other topics, such as, covered call ETF's or bond ETF or asset allocation of a person's portfolio?  Thank you in advance for your feedback.  ",,False,False,0,self.investing,1nf4znu
AutoZone: massive stock growth with unimpressive earnings and revenue growth,Chuque,61,0.92,19,2025-09-11 12:05:09,https://www.reddit.com/r/investing/comments/1necrrl/autozone_massive_stock_growth_with_unimpressive/,https://www.reddit.com/r/investing/comments/1necrrl/autozone_massive_stock_growth_with_unimpressive/,"From 2021 to 2024, AutoZone's earnings went up 23%, while the stock is up 250%. Revenue is up 28%. The stock didn't dip like everything else in 2022. The stock price is rock solid and is climbing higher every single week. Even companies like Waste Management have higher earnings growth than this, and the stock price is not growing nearly as fast. What's going on?",,False,False,0,self.investing,1necrrl
International/Domestic Equities back and forth lately?,P4ULUS,0,0.17,1,2025-09-12 14:58:39,https://www.reddit.com/r/investing/comments/1nfbn44/internationaldomestic_equities_back_and_forth/,https://www.reddit.com/r/investing/comments/1nfbn44/internationaldomestic_equities_back_and_forth/,"Anyone else with exposure to domestic and international indices like VOO, QQQ vs VXUS, VWO notice a back and forth happening recently where international is up some days and then seemingly down the next while domestic US are up?

Any idea what is causing this?

I've been investing in these ETFs for years and haven't noticed such swings until recently. Usually, they are pretty correlated.

But now it seems either it's an international/emerging markets day or a strong day for US/down for intl, bac",,False,False,0,self.investing,1nfbn44
Rate cut crash vs positive statistical forecast...how to reconcile conflicting views?,backcountry90320,5,0.86,1,2025-09-11 23:55:09,https://www.reddit.com/r/investing/comments/1net9pu/rate_cut_crash_vs_positive_statistical/,https://www.reddit.com/r/investing/comments/1net9pu/rate_cut_crash_vs_positive_statistical/,"I read rate cut cycles correspond with major market crashes

Example: [https://x.com/StealthQE4/status/1966276540314038466](https://x.com/StealthQE4/status/1966276540314038466)

But then I read statistical correlational data that suggest we are good for another 12 months

Example: [https://x.com/SubuTrade/status/1966234375256944823/photo/1](https://x.com/SubuTrade/status/1966234375256944823/photo/1)

**How do you reconcile this?**

The only way I see both being true is if we actually don't have ",,False,False,0,self.investing,1net9pu
"19, Full time job while in college, living on my own. How do I start investing for my future",secretlyadam,3,0.67,13,2025-09-12 01:22:42,https://www.reddit.com/r/investing/comments/1neusy4/19_full_time_job_while_in_college_living_on_my/,https://www.reddit.com/r/investing/comments/1neusy4/19_full_time_job_while_in_college_living_on_my/,"Hello, I'm 19 and work a full time job while going to college. One of the biggest things I've been told I need to do is start investing. I've heard about ETFs and the S&amp;P500 and other things like that but don't know what they are necessarily. Tried to do my own research before coming on here and I'm still pretty confused. I was thinking of opening a ROTH IRA but I'm not sure what to invest in lol. I close on my own home in a few weeks, and I really want to start to get ahead with my adult li",,False,False,0,self.investing,1neusy4
What is a safe place to invest ~250K without incurring ordinary income tax every year?,PHL1365,0,0.35,22,2025-09-12 17:03:42,https://www.reddit.com/r/investing/comments/1nfetfy/what_is_a_safe_place_to_invest_250k_without/,https://www.reddit.com/r/investing/comments/1nfetfy/what_is_a_safe_place_to_invest_250k_without/,"Situation is that I want to keep income at zero while I do Roth conversions in early retirement. The 250K would be to cover living expenses for 3-5 years. Looking for returns that are similar to HYSA, but would only be taxable (at capital gains rate) upon withdrawal. 

My understanding is that bond and money market funds pay dividends which are taxed as ordinary income. Are there any funds that automatically reinvest dividends without a tax hit?

Would tax-free munis be worth the reduced returns",,False,False,0,self.investing,1nfetfy
Wimped out of my first great trade,Mindless_Ad5721,0,0.29,19,2025-09-12 17:10:24,https://www.reddit.com/r/investing/comments/1nfezrw/wimped_out_of_my_first_great_trade/,https://www.reddit.com/r/investing/comments/1nfezrw/wimped_out_of_my_first_great_trade/,"I was tracking this stock for awhile. Got in at a confident buy price. Learned some more info about the company and decided to sell and diversify. Looking now at about $3k missing if I had held. I just started investing this year, so that would be a big chunk of my portfolio. Still up 40% this year but this one hurts.",,False,False,0,self.investing,1nfezrw
A lot of IPOs skyrocketed this year. Are there any that are still reasonably priced and considered a good value investment?,JamestotheJam,13,0.74,13,2025-09-11 16:53:47,https://www.reddit.com/r/investing/comments/1nekb2d/a_lot_of_ipos_skyrocketed_this_year_are_there_any/,https://www.reddit.com/r/investing/comments/1nekb2d/a_lot_of_ipos_skyrocketed_this_year_are_there_any/,"Looking at some of these IPOs and their initial volatility, it's sometimes hard to say whether they are a good value at their current prices. I was specifically looking back at the following IPOs this year:

* Figure Technology - Launched today. Promising?
* Coreweave - down from its ATH. Future growth w/ nVidia?
* Newsmax - initially hyped up. Near IPO price now and flatlining.
* Firefly Aerospace - Declined from initial IPO. Good complement to RKLB?
* Voyager - Declined from initial IPO.
* Fig",,False,False,0,self.investing,1nekb2d
Investments for Upcoming Fed Rate Cut,BraveG365,21,0.72,55,2025-09-11 12:53:23,https://www.reddit.com/r/investing/comments/1nee0yk/investments_for_upcoming_fed_rate_cut/,https://www.reddit.com/r/investing/comments/1nee0yk/investments_for_upcoming_fed_rate_cut/,"If someone has some money sitting on the side what would be some good choices to purchase before the Fed rate cut in hopes of a nice bump after the cut?

I have read that some analyst believe that the rate cut will cause the market to soar for a short time after, but then there are some that believe it could make a drop for a short time.

So what would be some ETF's or stocks to buy before to maybe catch a nice bump up?

Thanks",,False,False,0,self.investing,1nee0yk
Solo 401k contributions question,diamondsnrose,11,0.92,11,2025-09-11 17:13:57,https://www.reddit.com/r/investing/comments/1nektco/solo_401k_contributions_question/,https://www.reddit.com/r/investing/comments/1nektco/solo_401k_contributions_question/,"Can someone clarify this:

""For the 2025 tax year, you can contribute as an employee up to $23,500, or 100% of your compensation, whichever is less. In addition, as the employer, you can contribute up to 25% of your compensation to the plan.""

Can I contribute $23,500+25% of my income? I will make roughly $23,500, let's make the math easy: Can I contribute up to $29,375?

I am a freelancer. This is the first year it's been my only income. I have no savings option other than my Schwab acct so I w",,False,False,0,self.investing,1nektco
Why Solana Could Outperform BTC and ETH by Year-End,Gr33nC4ndl3,0,0.24,14,2025-09-12 19:09:40,https://www.reddit.com/r/investing/comments/1nfhv6e/why_solana_could_outperform_btc_and_eth_by_yearend/,https://www.reddit.com/r/investing/comments/1nfhv6e/why_solana_could_outperform_btc_and_eth_by_yearend/,"With the SEC’s green light on ETFs and the upcoming Fed rate cuts, the stage is set for a massive shift in liquidity and risk appetite across the market. While Bitcoin and Ethereum will obviously benefit, the real asymmetric upside may lie in Solana.

Here’s why:

Higher % rally potential: BTC and ETH are already highly capitalized, so even with institutional inflows, their upside is relatively more capped. Solana, on the other hand, still has room to deliver a multiple-x move within the same ma",,False,False,0,self.investing,1nfhv6e
I built a tool to spotlight one community stock each day (feedback welcome),eveul_kneveul,6,0.88,7,2025-09-11 18:48:50,https://www.reddit.com/r/investing/comments/1nen19s/i_built_a_tool_to_spotlight_one_community_stock/,https://www.reddit.com/r/investing/comments/1nen19s/i_built_a_tool_to_spotlight_one_community_stock/," Hey all,

I’ve been frustrated with how most stock coverage just recycles the same tickers, while interesting plays highlighted by the retail community don’t get a clean, digestible deep dive. So I started a tiny project called[ OneDailyStock.com](https://onedailystock.com).

The idea is simple: each day it highlights one stock that seems to have strong potential but balanced risk, based on what the retail community is noticing. Today’s pick is Rocket Lab for example, and the writeup goes into ",,False,False,0,self.investing,1nen19s
The AI circle of money...,ramdomwalk,252,0.93,70,2025-09-10 22:18:58,https://www.reddit.com/r/investing/comments/1ndx37w/the_ai_circle_of_money/,https://www.reddit.com/r/investing/comments/1ndx37w/the_ai_circle_of_money/,"1. $NVDA sells GPUs to $ORCL. Oracle uses to power its data centers
2. Oracle builds cloud on those GPUs
3. Nvidia rents compute back via signed deals from Oracle

Nvidia gets recurring revenue from hardware sales and cloud services without owning all the data centers. Oracle turns capex (buying GPUs) into opex revenue by renting compute to Nvidia, OpenAI, and others.

More AI Stocks Watchlist: $MRVL $AVGO $NBIS $AIFU $IREN $CRWV",,False,False,0,self.investing,1ndx37w
