title,author,score,upvote_ratio,num_comments,created_utc,url,permalink,selftext,flair,is_video,over_18,gilded,domain,post_id
Am I missing something about the S&amp;P 500 fears?,NoPower4961,0,0.39,20,2025-09-13 13:42:16,https://www.reddit.com/r/Bogleheads/comments/1ng3r1d/am_i_missing_something_about_the_sp_500_fears/,https://www.reddit.com/r/Bogleheads/comments/1ng3r1d/am_i_missing_something_about_the_sp_500_fears/,"I'm a passive investor mainly in the S&amp;P 500 over the last 5 years. Recently, i have been seeing a lot of popular investors and influencers alike warning against the S&amp;P500. While I understand the rationale behind their concerns, the alternatives they propose don't really make sense to me. I will highlight each reason and my thoughts around it.

1. Diversifaction: The United States has been the world's economic powerhouse for centuries and has the most mature capital markets. Wouldn't it",,False,False,0,self.Bogleheads,1ng3r1d
Avantis excluding tobacco companies from most of their funds,Maleficent_Bunch_442,19,0.8,12,2025-09-12 12:41:33,/r/avantis/comments/1nf84ug/avantis_excluding_tobacco_companies_from_most_of/,https://www.reddit.com/r/Bogleheads/comments/1nf85be/avantis_excluding_tobacco_companies_from_most_of/,,,False,False,0,,1nf85be
Has the stock market become completely decoupled from the economy?,RNG_HatesMe,727,0.91,320,2025-09-11 17:02:09,https://www.reddit.com/r/Bogleheads/comments/1nekirf/has_the_stock_market_become_completely_decoupled/,https://www.reddit.com/r/Bogleheads/comments/1nekirf/has_the_stock_market_become_completely_decoupled/,"It's generally posited that the Stock Market is forward looking, and valuations include expected future changes.  The stock market keeps hitting record highs.  I personally am currently up 8% over the last 90 days and up 14% over the last year (standard Bogle type portfolio, 80/20 equities/bonds).

Yet economic news is almost nothing but negative except for niche industries like AI.  Job growth is anemic, inflation is high, wage growth is slow or stagnant, unemployment is rising.  Tariff costs a",,False,False,0,self.Bogleheads,1nekirf
Feedback please on a  Euro retirement portfolio,otsoaingles,1,1.0,3,2025-09-13 04:09:46,https://www.reddit.com/r/Bogleheads/comments/1nfry6q/feedback_please_on_a_euro_retirement_portfolio/,https://www.reddit.com/r/Bogleheads/comments/1nfry6q/feedback_please_on_a_euro_retirement_portfolio/,"Assume I'm 50 and retiring now, and have a lump sum of €2 million to start with. 

**Proposed Portfolio:**

* €240K cash buffer (4 years of draw down)
* €1.76 million split:
   * 60% WEBN - [https://www.justetf.com/uk/etf-profile.html?isin=IE0003XJA0J9](https://www.justetf.com/uk/etf-profile.html?isin=IE0003XJA0J9)
   * 20% MEUD - [https://www.justetf.com/uk/etf-profile.html?isin=LU0908500753](https://www.justetf.com/uk/etf-profile.html?isin=LU0908500753)
   * 20% VAGF - [https://www.justetf.com",,False,False,0,self.Bogleheads,1nfry6q
Third world Bogleing,Mitsoni,6,1.0,0,2025-09-12 19:11:21,https://www.reddit.com/r/Bogleheads/comments/1nfhwj2/third_world_bogleing/,https://www.reddit.com/r/Bogleheads/comments/1nfhwj2/third_world_bogleing/,"I know most of the people here are either US or EU based. Another good portion are from other more or less developed countries. As an expat in Africa I'd like to start a discussion about investing from these developing nations, the emerging markets, the third world, the banana republics, if you wish. These countries don't have many investors, for obvious reasons, but I believe things are changing and more and more people are coming out of poverty every day. And technology makes it possible for e",Non-US Investors,False,False,0,self.Bogleheads,1nfhwj2
"M28 UK, and have £10,000 saved up. Where should I start.",MaximumRip6283,1,0.53,20,2025-09-13 03:20:36,https://www.reddit.com/r/Bogleheads/comments/1nfr60t/m28_uk_and_have_10000_saved_up_where_should_i/,https://www.reddit.com/r/Bogleheads/comments/1nfr60t/m28_uk_and_have_10000_saved_up_where_should_i/,"I only have £10,000 saved up in my savings account. I feel so far behind everyone else when it comes to investing, thankfully I have a 1 bedroom apartment that I bought when I was 18 and paid off fully last year. 

As well as the £10,000 I can start investing, I can put away £700 a month into investments. 

What should I do? :/ 
",Investing Questions,False,False,0,self.Bogleheads,1nfr60t
What if when I want access to my assets the market tanks?,iii-xi,0,0.22,11,2025-09-13 12:00:16,https://www.reddit.com/r/Bogleheads/comments/1ng15th/what_if_when_i_want_access_to_my_assets_the/,https://www.reddit.com/r/Bogleheads/comments/1ng15th/what_if_when_i_want_access_to_my_assets_the/,"I’ve been thinking about life when I’m living off accumulated assets and trying to examine the right asset mix for that phase.

Traditional wisdom says: stay in the market, weather the storms, and avoid trying to time it. That’s sound advice, especially when history shows that pulling out in downturns is suboptimal to say the least.

But what if the timing of when I want to turn these to cash to live off of is less than ideal?

Traditional wisdom also says to keep some allocation in bonds or cas",,False,False,0,self.Bogleheads,1ng15th
Tax Gain Harvesting and State Taxes (OH),Supdude3,3,1.0,4,2025-09-12 20:19:44,https://www.reddit.com/r/Bogleheads/comments/1nfjdq5/tax_gain_harvesting_and_state_taxes_oh/,https://www.reddit.com/r/Bogleheads/comments/1nfjdq5/tax_gain_harvesting_and_state_taxes_oh/,"I make a pretty modest income grossing about 50k including regular income and dividends.  With the standard deduction of 15k, I have roughly 12k of long term capital gains to realize at 0% federal tax.

~~But Ohio has a 2.75% blanket capital gains tax~~  my tax bracket would be 2.75% for capital gains (no special rate for long term).  So, is it worth it tax gain harvest and pay that tax to reset my cost basis?

OR sell some of my appreciated stock that I don't care for, that were carried over my",Investing Questions,False,False,0,self.Bogleheads,1nfjdq5
Advice for college money,Eclipsed01,2,0.75,4,2025-09-12 21:25:18,https://www.reddit.com/r/Bogleheads/comments/1nfkqax/advice_for_college_money/,https://www.reddit.com/r/Bogleheads/comments/1nfkqax/advice_for_college_money/,"Hello,

Im currently a college student and unfortunately my tuition isn't covered entirely, with loans and scholarships it covers a decent chunk though. I have a few grand I'll use to pay off the rest that I'll continue to add onto until payments are due (spring) in the meantime. My current savings account has a rate of 3.5%, where would be a safe place to hold this through fidelity to get a little bit more growth? I've been considering SGOV but I wish to get more opinions.",Investing Questions,False,False,0,self.Bogleheads,1nfkqax
Add VT or sell and transfer?,housebg,6,0.88,12,2025-09-12 13:57:56,https://www.reddit.com/r/Bogleheads/comments/1nfa3pk/add_vt_or_sell_and_transfer/,https://www.reddit.com/r/Bogleheads/comments/1nfa3pk/add_vt_or_sell_and_transfer/,"I currently have money in VTIAX, SWTSX &amp; AVDV.  I like the idea of just having VT for total global market, as my understanding is the composition will change over time to react to whatever new thing happens out there.   
  
Should I keep my money in the existing funds and just make new contributions to VT?  Or is it better to sell out of the existing ones and move everything over to VT? ",,False,False,0,self.Bogleheads,1nfa3pk
Looking for advice on how to allocate my investments using the funds on this list.,Sad-Technology-3815,1,1.0,9,2025-09-12 23:41:08,https://www.reddit.com/r/Bogleheads/comments/1nfndna/looking_for_advice_on_how_to_allocate_my/,https://www.reddit.com/r/Bogleheads/comments/1nfndna/looking_for_advice_on_how_to_allocate_my/,"I'm (clearly) not very well-versed in this stuff but am trying to learn. I'm 44 and have 180K in an American Funds 401K. I only contribute the amount required to get the employer match to the 401K, and max out a Roth IRA otherwise.

https://preview.redd.it/73qwrzj3suof1.png?width=1560&amp;format=png&amp;auto=webp&amp;s=faabb883b8f4034df769ce58ad3bbc16be678f1b

  


Currently I have 60% of the 401K in American Funds Growth Fund of America R5E (RGAHX), and 40% in Capital Group American Balanced Tr",,False,False,0,self.Bogleheads,1nfndna
question about state income taxes,badabingbadaboomie,0,0.5,2,2025-09-12 22:57:28,https://www.reddit.com/r/Bogleheads/comments/1nfmjm4/question_about_state_income_taxes/,https://www.reddit.com/r/Bogleheads/comments/1nfmjm4/question_about_state_income_taxes/,"i have a regular investment account with vanguard and also some money market accounts. i've been getting some dividends and capital gains from both account types

i moved from seattle to chicago about a month ago. there is no state income tax in seattle, but i realized that chicago does. when i fill out my tax return next year, how will the taxes work? will i be taxed for all of the dividends and capital gains i got in 2025, even though i lived in seattle until august?",Investing Questions,False,False,0,self.Bogleheads,1nfmjm4
401k FXAIX and FTIHX,niiiick1126,5,0.74,10,2025-09-12 11:28:51,https://www.reddit.com/r/Bogleheads/comments/1nf69ow/401k_fxaix_and_ftihx/,https://www.reddit.com/r/Bogleheads/comments/1nf69ow/401k_fxaix_and_ftihx/,"Hello! So I just started my new job and wanted to replicate VT/ VTI and VXUS in my 401k

However there is no FXAIX so is FXAIX and FTIHX okay for my 401k? I was thinking a 65/35 split. ",,False,False,0,self.Bogleheads,1nf69ow
"Be Aware, Vanguard's Personal Advisors",Taciturnityz,185,0.87,38,2025-09-11 17:22:03,https://www.reddit.com/r/Bogleheads/comments/1nel0dv/be_aware_vanguards_personal_advisors/,https://www.reddit.com/r/Bogleheads/comments/1nel0dv/be_aware_vanguards_personal_advisors/,"issues discussed in a Philadelphia newspaper article [ no paywall, so far]

https://www.inquirer.com/business/vanguard-sec-lawsuit-fines-personal-advisor-service-20250911.html


https://www.sec.gov/enforcement-litigation/administrative-proceedings/ia-6912-s

To sum:

"".. Vanguard Advisers used a compensation system that financially incentivized its advisors that serviced PAS ...through bonuses, salary increases, and, at times, promotions—to recommend that clients enroll and remain in the PAS pro",,False,False,0,self.Bogleheads,1nel0dv
Should I buy a home or rent?,slotthrowaway,10,0.63,42,2025-09-12 08:35:08,https://www.reddit.com/r/Bogleheads/comments/1nf20vo/should_i_buy_a_home_or_rent/,https://www.reddit.com/r/Bogleheads/comments/1nf20vo/should_i_buy_a_home_or_rent/,"I'm a 30-year-old US citizen and have $425,000 in VT. That's the vast majority of my assets aside from liquid cash and other assets that are essential for my job. I've lived with my mom my whole life, but she wants to rent out my living space and is no longer allowing me to live with her without paying rent. I decided to move to Texas since it has no state income tax.

My taxable income is probably between $100,000-$200,000 yearly. It fluctuates, as I am self-employed.

Given just this informati",,False,False,0,self.Bogleheads,1nf20vo
Retired parent downsizing. Where to put remaining proceeds from sale of home?,nielsboar,5,1.0,8,2025-09-12 13:40:50,https://www.reddit.com/r/Bogleheads/comments/1nf9o0x/retired_parent_downsizing_where_to_put_remaining/,https://www.reddit.com/r/Bogleheads/comments/1nf9o0x/retired_parent_downsizing_where_to_put_remaining/,"My mother is 70 and has recently sold the long-standing family home to downsize into something she can manage.  There should be a remainder of \~$200k that my sister and I do not expect to be needed for day to day living, and we are looking to invest this such that it should cover her annual large ticket items like home related insurance and taxes.  Those should come to around $5-6k per year.

Questions:

* Should this all just go into a regular brokerage account at her age?
* Is 3-5 years of th",,False,False,0,self.Bogleheads,1nf9o0x
Need to vent: Finally pulling money from actively managed fund after years of underperformance,jamesr219,80,0.94,44,2025-09-11 21:26:23,https://www.reddit.com/r/Bogleheads/comments/1neqchy/need_to_vent_finally_pulling_money_from_actively/,https://www.reddit.com/r/Bogleheads/comments/1neqchy/need_to_vent_finally_pulling_money_from_actively/,Currently invested in actively managed pooled funds through a profession-specific firm (about $4.2B AUM according to their latest ADV). The fund is supposed to be growth with a 70% equity/30% bond allocation and hire private money managers for the fund. It was recommended to us by saying given their AUM they have access to money managers which would only normally be available to institutions and should be able to provide consistent results to meet our retirement goals. They said it won't be exci,,False,False,0,self.Bogleheads,1neqchy
HSA with Union Insurance,Novel_Bill_2989,0,0.5,4,2025-09-12 20:56:00,https://www.reddit.com/r/Bogleheads/comments/1nfk4n9/hsa_with_union_insurance/,https://www.reddit.com/r/Bogleheads/comments/1nfk4n9/hsa_with_union_insurance/,"I have an insanely good union insurance plan. I barely spend out of pocket on anything. For example, the only deductible I pay for is my therapist which is ten dollars a session every other week. My prescriptions are routinely under 5 dollars. My dentist visits twice a year are 20 bucks. Other than that everything is covered. We recently had a baby and I owed nothing even with extended hospital stay and epidural that was 3000. Should I even have an HSA? I guess I could put away a few hundred and",,False,False,0,self.Bogleheads,1nfk4n9
.5 AUM reasonable?,SansSerif21,3,0.56,59,2025-09-12 14:49:37,https://www.reddit.com/r/Bogleheads/comments/1nfbeoy/5_aum_reasonable/,https://www.reddit.com/r/Bogleheads/comments/1nfbeoy/5_aum_reasonable/,"Is this a reasonable fee for investment and retirement planning, and estate advice? For a portfolio over a million. ",,False,False,0,self.Bogleheads,1nfbeoy
Advice on tax-efficient asset placements (ROTH vs taxable brokerage),moonchild_2468,0,0.5,3,2025-09-12 19:56:55,https://www.reddit.com/r/Bogleheads/comments/1nfiw08/advice_on_taxefficient_asset_placements_roth_vs/,https://www.reddit.com/r/Bogleheads/comments/1nfiw08/advice_on_taxefficient_asset_placements_roth_vs/,"My current allocation in ROTH is a 4-fund portfolio: Total US (VTI) 55%, International (SCHF) 30%, Total US Bond (BND) 10%, and Real Estate (FREL) 5%.

After maxing out ROTH, I am now opening up a brokerage account. For context, I live in a very high-tax city and in my late 20s.

I’m debating between two strategies:

**A)** Place the more tax-inefficient holdings (BND and FREL) entirely in the Roth to avoid taxes. Then, use whatever Roth space is left for VTI, and put the rest of VTI/SCHF in my ",,False,False,0,self.Bogleheads,1nfiw08
Vanguard How America Saves 2025 Edition,Savings-Wallaby7392,59,0.91,20,2025-09-11 21:18:56,https://www.reddit.com/r/Bogleheads/comments/1neq70w/vanguard_how_america_saves_2025_edition/,https://www.reddit.com/r/Bogleheads/comments/1neq70w/vanguard_how_america_saves_2025_edition/,https://institutional.vanguard.com/content/dam/inst/iig-transformation/insights/pdf/2025/has/2025_How_America_Saves.pdf,,False,False,0,self.Bogleheads,1neq70w
Investment advice- Inherited Ira into taxable brokerage account.,SnoopDoug523,0,0.5,8,2025-09-12 19:16:02,https://www.reddit.com/r/Bogleheads/comments/1nfi0bg/investment_advice_inherited_ira_into_taxable/,https://www.reddit.com/r/Bogleheads/comments/1nfi0bg/investment_advice_inherited_ira_into_taxable/,"I just recently inherited a $450k IRA + $300k in cash 💰 + $115k in Ibonds (from my dad who just passed away this summer 😢. )


I have 10 years to withdraw all the funds out of the inherited IRA , and i wanted to invest at least $200k cash now into a taxable brokerage account because im also retired with no way of contributing it to an existing IRA/Roth IRA . 

I was thinking i could reinvest  
$45k per year from my inherited IRA distributions(45x10=450k)into my taxable brokerage account along wi",Investing Questions,False,False,0,self.Bogleheads,1nfi0bg
Target date vs my own selections,CairoRisk,0,0.4,5,2025-09-12 18:33:31,https://i.redd.it/d2q5bofb9tof1.jpeg,https://www.reddit.com/r/Bogleheads/comments/1nfh152/target_date_vs_my_own_selections/,"Wondering whether I should just go with a target date fund for my employers 403b account or use a combo of these to mimic a ~70/30 split of VTI/VXUS. These are the only fund options I have. I know a target date fund is easier and more convenient, but I’m only 29, don’t want bonds yet, and feel like the TDFs are all too international heavy. Is it worth the effort of rebalancing myself? ",,False,False,0,i.redd.it,1nfh152
Conversion from managed funds,No_Resident1622,4,0.84,7,2025-09-12 10:38:51,https://www.reddit.com/r/Bogleheads/comments/1nf4zy5/conversion_from_managed_funds/,https://www.reddit.com/r/Bogleheads/comments/1nf4zy5/conversion_from_managed_funds/,"This sub has given me so much insight into the simplicity and power of self managed index fund investing, so first off, very much appreciated! I finally converted around 140k from a managed Morgan Stanley account into Fidelity, which landed about 54 individual holdings….

I’m really a bit stuck on the best strategy to sell out of these positions and move towards    chosen Index ETF’s. Should it just be all at once or a gradual transition? Sell some of the duds a little at a loss? I’m sure from r",,False,False,0,self.Bogleheads,1nf4zy5
FDRXX VS SPAXX for core fund,pgb205,3,1.0,6,2025-09-12 11:33:27,https://www.reddit.com/r/Bogleheads/comments/1nf6dvx/fdrxx_vs_spaxx_for_core_fund/,https://www.reddit.com/r/Bogleheads/comments/1nf6dvx/fdrxx_vs_spaxx_for_core_fund/,"This will be in tax protected account.

The difference is 6 basis points.

The risk level is the same as far as I can tell. 

Both are SPIC but not FDIC insured.

  
Does it make sense to chose one over the other for a small increase in gain?

  
thanks.",,False,False,0,self.Bogleheads,1nf6dvx
Advisor or DIY... HELP!,SelectLifeguard3902,2,1.0,5,2025-09-12 13:01:47,https://www.reddit.com/r/Bogleheads/comments/1nf8o6p/advisor_or_diy_help/,https://www.reddit.com/r/Bogleheads/comments/1nf8o6p/advisor_or_diy_help/,"What: We have around 2M in non-taxable accounts and 5M sitting in high interest savings &amp; CDs (due to a few very lucky moves with my company - private/public/private in a very short amt of time). I know this was not the smartest move, but it just sort of accumulated while we were distracted with a near catastrophic medical issue that went on for almost 2 years. Cash was earning 4-5%, and we decided best to keep it liquid while we dealt w/ a massive life curveball. 

Everything has now settle",,False,False,0,self.Bogleheads,1nf8o6p
Vanguard fines for misleading customers,DrawingOk8403,54,0.82,19,2025-09-11 19:04:01,https://www.wealthmanagement.com/regulation-compliance/vanguard-to-pay-19-5m-to-settle-sec-conflict-disclosure-charges,https://www.reddit.com/r/Bogleheads/comments/1nendh9/vanguard_fines_for_misleading_customers/,Is this why we are skeptical of managed/advisory services ?,Bogleheads.org,False,False,0,wealthmanagement.com,1nendh9
Should I sell my high dividend stock and buy VTI instead?,Low-Computer8293,31,0.84,14,2025-09-11 21:05:25,https://www.reddit.com/r/Bogleheads/comments/1nepx2t/should_i_sell_my_high_dividend_stock_and_buy_vti/,https://www.reddit.com/r/Bogleheads/comments/1nepx2t/should_i_sell_my_high_dividend_stock_and_buy_vti/,"I have some shares of high dividend stock. This was money earned from a side gig, and the purpose of this fund was to give myself a little spending money. I didn't think the side gig income would be there forever (it wasn't) so I wanted something that I could feel comfortable spending without worrying about lifestyle creep. The real purpose was to give myself some spending money, guilt free, for whatever hobby or interest I had at the moment. I'm not sure that I feel that I need that money for t",,False,False,0,self.Bogleheads,1nepx2t
Newbie needs help.,jmundo11,1,1.0,9,2025-09-12 14:46:01,https://www.reddit.com/r/Bogleheads/comments/1nfbbgl/newbie_needs_help/,https://www.reddit.com/r/Bogleheads/comments/1nfbbgl/newbie_needs_help/,"I need help deciding what to do with my cash and current investments. I have about 200k cash in a cash management account earning now under 4% and I'm looking to invest about 100k. I don't have much time during the day as I work in retail and work up to 10-12 hours a day including weekends at times. I have about 80k between a Roth IRA and an Individual account with Fidelity that I was ""trying"" training to manage myself. 

I am meeting with a Fidelity local office next week and also have the oppo",Investing Questions,False,False,0,self.Bogleheads,1nfbbgl
"Age 32, moving all new funds to BogleHead",Kind-Bookkeeper3602,2,0.75,13,2025-09-12 11:00:14,https://www.reddit.com/r/Bogleheads/comments/1nf5j80/age_32_moving_all_new_funds_to_boglehead/,https://www.reddit.com/r/Bogleheads/comments/1nf5j80/age_32_moving_all_new_funds_to_boglehead/,"I have Schwab so I've been working towards, thoughts?:

* 56% U.S. Total Stock (SWPPX/SCHG/SCHD)
* 24% International Stock (SCHF)
* 20% Total U.S. Bond (SCHZ)",Portfolio Review,False,False,0,self.Bogleheads,1nf5j80
"21, first time with real savings (~$100k)… not sure what to do next",Primary_Ad9506,0,0.5,2,2025-09-12 13:34:20,https://www.reddit.com/r/Bogleheads/comments/1nf9i5y/21_first_time_with_real_savings_100k_not_sure/,https://www.reddit.com/r/Bogleheads/comments/1nf9i5y/21_first_time_with_real_savings_100k_not_sure/,"Hi all,

I’m new here and pretty new to investing in general. I’m 21 and somehow ended up with about $100k thanks to crypto this cycle. It still feels surreal because a couple years ago I was worried about paying for basic stuff, and now I have this lump sum that I honestly don’t know how to handle.

I know this community focuses on long-term and steady investing, which is exactly why I’m asking. I don’t want to blow this or make dumb mistakes.

If you were 21 with $100k, where would you even st",Investing Questions,False,False,0,self.Bogleheads,1nf9i5y
Using the Russell 2000 to protect against market concentration,MrDinglehut,0,0.4,9,2025-09-12 13:17:23,https://www.reddit.com/r/Bogleheads/comments/1nf92i4/using_the_russell_2000_to_protect_against_market/,https://www.reddit.com/r/Bogleheads/comments/1nf92i4/using_the_russell_2000_to_protect_against_market/,"I have a 40% US stock (total market index), 20% international and 40% US bond 401k. 

I am nervous. Not about stocks in general. Just about the top 10 stocks having such a large portion of the index. The only reason I am nervous is that I am 63 and plan to retire in 2 years. If I was 50 I would not care. 

With the funds available to me I can either:

1) Ignore it. 

2) Go to 30% US stock, 20% international and 50% bond.

3) Go to 30% US stock, 20% international, 40% bond and add 10% Russell 200",Investing Questions,False,False,0,self.Bogleheads,1nf92i4
How to exchange &gt;$200K in stock for TDF,neurdle,2,0.75,3,2025-09-12 09:27:12,https://www.reddit.com/r/Bogleheads/comments/1nf3897/how_to_exchange_200k_in_stock_for_tdf/,https://www.reddit.com/r/Bogleheads/comments/1nf3897/how_to_exchange_200k_in_stock_for_tdf/,"
TL;DR: what’s a good way to exchange $200K in equities for a TDF in a 401k without stressing?

I’d like some advice on suitable technique to rebalance my spouse’s 401k. 

For his previous job, his investments were 100% equities, nearly all US. That chunk is over $200k right now, comprised of 4 stock mutual funds. At his current job, he’s invested 100% in a TDF. Both jobs use TIAA and he never rolled over, and we’re not wanting to roll over right now for various reasons. He’s a set it and forget",,False,False,0,self.Bogleheads,1nf3897
Do NOT Sell Using SpecID Cost Basis! (Website Issue),sparkyoliver1,49,0.78,24,2025-09-11 15:51:25,https://www.reddit.com/r/Bogleheads/comments/1neip9w/do_not_sell_using_specid_cost_basis_website_issue/,https://www.reddit.com/r/Bogleheads/comments/1neip9w/do_not_sell_using_specid_cost_basis_website_issue/,"As most have seen, SpecID is no longer allowed as a default cost basis, but you can still select it when selling. That's what I did yesterday. It even let me select the shares I wanted as usual. Well, today I find out it used the default cost basis (FIFO) instead! I called, and I was told I wasn't the only one. I told them the correct shares, and they said they would fix it. I've been with Vanguard since 2016 with very few issues and none this major. This isn't a good look.",,False,False,0,self.Bogleheads,1neip9w
5 years away from retirement and newbie to BogleHeads,HiBriGuy63,37,0.88,18,2025-09-11 17:23:49,https://www.reddit.com/r/Bogleheads/comments/1nel1u8/5_years_away_from_retirement_and_newbie_to/,https://www.reddit.com/r/Bogleheads/comments/1nel1u8/5_years_away_from_retirement_and_newbie_to/,"I'm 62 years old, have a net worth of $2.5M, not including my residence, and I've only recently discovered this group, passive index investing, etc.  I applaud those of you that are younger and especially in your 20s that are adopting this philosophy. I wish I had discovered this myself back then.

I've used financial planners over the years, but most of my wealth accumulation has been due to lucky investments in private equity that I've had through my employers. I don't lead an extravagant life",,False,False,0,self.Bogleheads,1nel1u8
