title,author,score,upvote_ratio,num_comments,created_utc,url,permalink,selftext,flair,is_video,over_18,gilded,domain,post_id
I want to invest $2500 a month,Zealousideal_Term281,0,0.39,21,2025-09-12 12:16:24,https://www.reddit.com/r/investing/comments/1nf7i1u/i_want_to_invest_2500_a_month/,https://www.reddit.com/r/investing/comments/1nf7i1u/i_want_to_invest_2500_a_month/,"Where/how do I invest. Like the title says I want to invest $2500 a month. 
I want to hold it for at least ten years, I want to use it to go towards a home or something around those lines to get to at least 300k is this doable? 

Now originally I wanted to save up the 2500 a month in a high yield savings account but I did not think the return would be the best versus investing. What should I do? Thank you for anyone who has advice, I've never invested and I don't know much at all so please break",,False,False,0,self.investing,1nf7i1u
Thoughts on ANGX (Angel Studios) as a Long-Term Play?,Aviers247,5,0.67,9,2025-09-11 16:25:59,https://www.reddit.com/r/investing/comments/1nejleo/thoughts_on_angx_angel_studios_as_a_longterm_play/,https://www.reddit.com/r/investing/comments/1nejleo/thoughts_on_angx_angel_studios_as_a_longterm_play/,"As a few of you know, angel Studios, a streaming company went live on the stock market today.

I’ve been digging into ANGX (Angel Studios) now that it’s newly public, and I’m curious what others think about this one in its early days.

A few things caught my attention:

In less than a year, Angel Studios grew its Guild membership from 600,000 to 1.5 million.

That kind of subscriber growth feels exponential and, in some ways, comparable to Netflix in its early expansion phase.

The company alrea",,False,False,0,self.investing,1nejleo
Surrendering a life insurance policy vs waiting,Brokenandbeaten,3,0.61,8,2025-09-11 22:06:31,https://www.reddit.com/r/investing/comments/1ner5li/surrendering_a_life_insurance_policy_vs_waiting/,https://www.reddit.com/r/investing/comments/1ner5li/surrendering_a_life_insurance_policy_vs_waiting/,"This is a fully funded policy that pays out 3.5million, upon death of parents. They are Mid 70s good health, possible 20 more years. No taxes on policy activation payout. Surrender value is 1.75million immediately, taxed at 37% top rate as it would be considered income. Expected 575-625k to each adult child. 

I did some hypotheticals with AI and it looked like 11% average gains for 10 years would be needed to break even point. 

The money isn’t needed, but it would make a great boost to retirem",,False,False,0,self.investing,1ner5li
"Equal Weight GRNY,  SPY, &amp; QQQ?  Why Not?",OneOpening3992,6,0.88,3,2025-09-11 15:27:31,https://www.reddit.com/r/investing/comments/1nei35l/equal_weight_grny_spy_qqq_why_not/,https://www.reddit.com/r/investing/comments/1nei35l/equal_weight_grny_spy_qqq_why_not/,"Thoughts on making these 3 my core holdings and equal weight with **the mind set of**, "" Set it and Forget it""  and only sell when I need money.  Usually I see post like this and wonder what is that person's situation. for me, it's the  ""Mind set of set it and forget it""  

  
Thanks in advance,

We all learn from others.

",,False,False,0,self.investing,1nei35l
Multiple Brokerage or One Brokerage for all investments,CibeerJ,7,0.89,16,2025-09-11 14:08:12,https://www.reddit.com/r/investing/comments/1neg0ny/multiple_brokerage_or_one_brokerage_for_all/,https://www.reddit.com/r/investing/comments/1neg0ny/multiple_brokerage_or_one_brokerage_for_all/,"With almost all brokerages now have to almost zero fees (or at least very minimal fees)  
Should I just use one brokerage for all my investments or have multiple brokerages? Im talking about just using one brokerage for IRA (Traditional/Roth), Stock and Bonds. It may not be applicable to 401K's as some companies have specific brokerages that they use but once your out of the company you can Roll it over to somewhere else. Thoughts?",,False,False,0,self.investing,1neg0ny
What is happening with asset prices?,dummonies,547,0.93,429,2025-09-10 13:04:47,https://www.reddit.com/r/investing/comments/1ndjzwr/what_is_happening_with_asset_prices/,https://www.reddit.com/r/investing/comments/1ndjzwr/what_is_happening_with_asset_prices/,"Oracle up 40% overnight as a 600b company.

Hot IPOs (FIG, CRCL) that go up multiples on listing.

Largest stock in the world (NVDA) up 60% YoY.

PLTR up 4x YoY.

HOOD up 4x from April. 

Bitcoin up 6x from 2023. 

Crypto treasury companies up unspeakable amounts. 

Gold up almost 2x since 2024. 

S&amp;P up almost 2x in 5 years, on a sky high PE ratio.






Is there really that much money in the world to buy these assets? 

No more dips, ever? 

Are we priced for everlasting money printing and",,False,False,0,self.investing,1ndjzwr
Oracle phenomena - “legacy” players pushing AI reaction?,MORICtrash,6,0.81,5,2025-09-11 12:18:54,https://www.reddit.com/r/investing/comments/1ned4dy/oracle_phenomena_legacy_players_pushing_ai/,https://www.reddit.com/r/investing/comments/1ned4dy/oracle_phenomena_legacy_players_pushing_ai/,"The recent case of Oracle got me thinking about the state of the markets, the AI hype and reality, and what it means for the future.

I’ve been pretty skeptical about Oracle’s surge, but they are about to recognize a lot of revenues. This market reaction is interesting because so far, the “big AI” bets were companies like Nvidia, Microsoft, Palantir, Google, Meta, Broadcom, etc. Oracle, by contrast, has long been seen as more of a legacy play, focused on infrastructure for large enterprises.

Wh",,False,False,0,self.investing,1ned4dy
Sentradel | Anti-Drone Weapons System,Zynergy17,0,0.14,3,2025-09-12 05:52:50,https://www.reddit.com/r/investing/comments/1neyzn5/sentradel_antidrone_weapons_system/,https://www.reddit.com/r/investing/comments/1neyzn5/sentradel_antidrone_weapons_system/,"I've been looking at a company called Sentradel that is specializing in a weapons system that counters drones. 

They advertise it as being a cheap and effective solution to small drones, such as those deployed in Ukraine. 

What are your thoughts on this? Could this be a highly lucrative investment, or another wannabe startup that likely never gets off the ground due to competition or theft of their software? 

Their current stock price is very small at
.00001706USD",,False,False,0,self.investing,1neyzn5
Thoughts on PayPal? Seems cheap,No_Page5201,5,0.78,2,2025-09-11 12:13:31,https://www.reddit.com/r/investing/comments/1neczc5/thoughts_on_paypal_seems_cheap/,https://www.reddit.com/r/investing/comments/1neczc5/thoughts_on_paypal_seems_cheap/,"PayPal seems like a decent bargain right now given how much it’s plummeted. They seem to be doing fairly well relative to the stock valuation. Anybody getting in at this price point? Thoughts on the company? 

I know they have some emerging competition and I’ve always preferred Venmo personally for ease of use but recently learned they own Venmo. ",,False,False,0,self.investing,1neczc5
"I want to know more about stocks for the wharton stock competition, how should I learn?",YesterdaySea7803,1,0.6,1,2025-09-11 20:55:03,https://www.reddit.com/r/investing/comments/1nepp9p/i_want_to_know_more_about_stocks_for_the_wharton/,https://www.reddit.com/r/investing/comments/1nepp9p/i_want_to_know_more_about_stocks_for_the_wharton/,"Hello,

  
I am a student that has just joined the wharton stock competition in high school with five other people. IT was really random, we just suddenly got stuck into our business club and now we're doing the competition. None of us really know about stocks or investing at all. How do I get started with learning about investing in general and getting ready for the competition?",,False,False,0,self.investing,1nepp9p
Dump extra cash on NASDAQ 100?,Apprehensive-Mine-22,6,0.69,8,2025-09-11 11:02:40,https://www.reddit.com/r/investing/comments/1neb6mx/dump_extra_cash_on_nasdaq_100/,https://www.reddit.com/r/investing/comments/1neb6mx/dump_extra_cash_on_nasdaq_100/,"Hey everyone. All this talk about inflation this, stagflation that, Interest rate cuts, etc. From my limited knowledge on how the economy works, I know all signs point to holding cash really sucks right now. I am thinking of putting my extra cash on QQQ/QQQM. I have a hefty position in GLDM, so I think I'm good to look for something with even higher growth potential. Thoughts? Anything else that isn't tech heavy that would be comparable to the NASDAQ 100? ",,False,False,0,self.investing,1neb6mx
"Why would anyone buy into stocks now, when they are at new ATHs? Isn't the market way too frothy?",JamestotheJam,0,0.32,24,2025-09-12 10:41:12,https://www.reddit.com/r/investing/comments/1nf5237/why_would_anyone_buy_into_stocks_now_when_they/,https://www.reddit.com/r/investing/comments/1nf5237/why_would_anyone_buy_into_stocks_now_when_they/,"Upside appears to be limited. Some stocks, even if you buy them now, are near or at new ATHs, and may only have a little more juice in them left. Rate cuts are already priced in.

2025 has been an insane rollercoaster. January started off strong. Mid-February to May was nothing but doom and gloom. And now, it's as if all the bad news has been disregarded or forgotten by institutional investors. What exactly is going on?",,False,False,0,self.investing,1nf5237
"Would now be a good time to get into Ethereum, Solana &amp; XRP",Proper-Plantain9387,0,0.21,25,2025-09-12 07:12:23,https://www.reddit.com/r/investing/comments/1nf0cp6/would_now_be_a_good_time_to_get_into_ethereum/,https://www.reddit.com/r/investing/comments/1nf0cp6/would_now_be_a_good_time_to_get_into_ethereum/,"With the Federal Reserve rate cut expected to increase overall liquidity next week and making credit cheaper, it's making large investors seek higher-risk assets like Bitcoin. This influx of capital on potentially trillions of $ is driving up the prices for digital assets, especially as institutional access through spot ETFs provides a direct pipeline for the investment.

A whole slew of ETF's on Ethereum, Solana &amp; XRP are waiting to be approved, so these are 2 large factors to try and get i",,False,False,0,self.investing,1nf0cp6
What’s going on with Oracle?,casterlyrockk,342,0.92,192,2025-09-10 12:00:44,https://www.reddit.com/r/investing/comments/1ndi7qr/whats_going_on_with_oracle/,https://www.reddit.com/r/investing/comments/1ndi7qr/whats_going_on_with_oracle/,"I don’t understand how it can be up 40% despite missing earnings. Yes I know they projected 500 billion revenue but still… 40%…? Is this just hype around AI/cloud? Or are investors pricing in something much bigger long term? I get that guidance matters more than a single earnings miss, but it feels extreme. Also, does this then necessarily mean there’s going to be a prolonged period of heightened volatility around Oracle and seeing whether this stratospheric revenue projection is met, or is this",,False,False,0,self.investing,1ndi7qr
Why this algo doesn’t just YOLO one stock,Sg0102,0,0.36,8,2025-09-12 03:35:03,https://www.reddit.com/r/investing/comments/1newwa5/why_this_algo_doesnt_just_yolo_one_stock/,https://www.reddit.com/r/investing/comments/1newwa5/why_this_algo_doesnt_just_yolo_one_stock/,"Backtest allocations included:
TQQQ (growth)

GLD (gold hedge)

TLT (bonds)

URA (uranium)

BTAL (hedge fund ETF)

Diversification helped balance risk while still delivering massive returns.
Do you think diversified algos are more reliable than single-asset ones?",,False,False,0,self.investing,1newwa5
Robinhood Strategies? How good is it?,depressednunu,0,0.5,2,2025-09-11 18:22:57,https://www.reddit.com/r/investing/comments/1nemfy4/robinhood_strategies_how_good_is_it/,https://www.reddit.com/r/investing/comments/1nemfy4/robinhood_strategies_how_good_is_it/,"How bad of an idea is to just keep on putting money into a managed investing account on Robinhood?Rather than picking out stocks or just making recurring investments into the S&amp;P and QQQ? I am a bit concerned about the tax implications as I don't really know what they are buying and selling. Maybe their tax loss harvesting is good enough? I am not sure.

**For me the allocations are:**

US Stocks: 81%

International Stocks: 14%

US Bonds: 4%

Cash 1%

The management fee is 0.25% of the entir",,False,False,0,self.investing,1nemfy4
$ACHR Is at a solid support range for a long term  investment,Defiant_Departure270,0,0.48,26,2025-09-11 17:43:29,https://www.reddit.com/r/investing/comments/1nelio1/achr_is_at_a_solid_support_range_for_a_long_term/,https://www.reddit.com/r/investing/comments/1nelio1/achr_is_at_a_solid_support_range_for_a_long_term/,"I would like to post that I think $ACHR is at a great place price wise for anyone thinking of investing long term in the eVTOL industry.

Can it move lower still? Anything is possible for the markets however one must remember the $850,000,000 for 85 Million shares at $10.00 per share that occurred not long ago. 

Yes we’re way below that huge investment by institutional investors. I feel $ACHR is at a great consolidation zone if one is dollar cost investing slowly and patiently. ",,False,False,0,self.investing,1nelio1
Best strategy for a non-tax advantage account?,gamedawgs,2,0.67,7,2025-09-11 11:09:02,https://www.reddit.com/r/investing/comments/1nebccw/best_strategy_for_a_nontax_advantage_account/,https://www.reddit.com/r/investing/comments/1nebccw/best_strategy_for_a_nontax_advantage_account/,"My Roth IRA is completely maxed out for the year, and I have cash sitting in my brokerage account that I’d like to invest. I know FXAIX is best in a tax advantaged account, and was wondering if FXAIX is still a good investment in my individual account. 

Do you have any recommendations for a long term hold (30 years) in my individual account? I’m open to any ETF/Mutual Fund/Stock as long as it’s fine in a taxable account. Thanks! ",,False,False,0,self.investing,1nebccw
Becoming a part time trader,Borealis_761,0,0.47,23,2025-09-11 16:56:18,https://www.reddit.com/r/investing/comments/1nekdcl/becoming_a_part_time_trader/,https://www.reddit.com/r/investing/comments/1nekdcl/becoming_a_part_time_trader/,I am interested in getting into trading and start trading part time. Is there a specific route you have taken to become a trader and have found success just doing it part time. I am in IT and have some time that I would like to use to get into investing. What sources did you use that helped you to get started. ,,False,False,0,self.investing,1nekdcl
Who's selling ORCL today?,thedukeofno,106,0.92,47,2025-09-10 14:21:42,https://www.reddit.com/r/investing/comments/1ndm3jr/whos_selling_orcl_today/,https://www.reddit.com/r/investing/comments/1ndm3jr/whos_selling_orcl_today/,"I first bought in just a shade under 20 years ago, and the stock has served me well with an annualized return of over 19%.

With a single-day gain of 40%, I've decided to cut my position by about 15% and take a bit of a profit. I normally view single-day rises like this as a windfall… sometimes what goes up quickly also comes back down, particularly since the rise defies (conventional) logic.

Anyone else?",,False,False,0,self.investing,1ndm3jr
Maintain cash savings with a 2-3 year Hozizon. Should I hold this allocation in my Roth IRA?,Fiveby21,3,0.67,13,2025-09-11 11:29:55,https://www.reddit.com/r/investing/comments/1nebv6b/maintain_cash_savings_with_a_23_year_hozizon/,https://www.reddit.com/r/investing/comments/1nebv6b/maintain_cash_savings_with_a_23_year_hozizon/,"A fairly large portion of my portfolio is cash (T-Bills) right now, as I am maintaining savings with which I could buy a house in 2-3 years. I'm thinking of re-allocating my portfolio so that more of the cash is kept within tax advantaged accounts - specifically my Roth IRA - as otherwise taxes eat away at the interest (I'm in a high bracket).

Example trade:

* Sell $10,000 T-Bills in Brokerage
* Buy $10,000 VTI in Brokerage.
* Sell $10,000 VTI in Roth
* Buy $10,000 T-Bill in Roth.

Portfolio d",,False,False,0,self.investing,1nebv6b
Where should she take her RMD from?,Angels_Rest,0,0.29,27,2025-09-11 20:54:29,https://www.reddit.com/r/investing/comments/1nepou6/where_should_she_take_her_rmd_from/,https://www.reddit.com/r/investing/comments/1nepou6/where_should_she_take_her_rmd_from/,"My mom sent me her T Rowe Price statement and asked me where she should take her next RMD from.

https://imgur.com/a/930crXf


First question: Why so many bond funds? What’s the advantage?

What would you consider doing and why?

Yes, I’d like to simplify this mess but alas, here I am and just trying to make a reasonable decision.

TIA",,False,False,0,self.investing,1nepou6
Shifting investment allocation percentages as you age.,TheImpPaysHisDebts,13,0.73,38,2025-09-10 22:33:02,https://www.reddit.com/r/investing/comments/1ndxdal/shifting_investment_allocation_percentages_as_you/,https://www.reddit.com/r/investing/comments/1ndxdal/shifting_investment_allocation_percentages_as_you/,"I was speaking with a colleague today and we were talking investment strategies for retirement (we are both in our late 50s).  Over the past \~10 years, he has shifted from a 50/50 stocks/bonds allocation to something like 20/80 (he wasn't clear if he was in time horizon funds or not).  Our difference of opinion was at the moment of retirement, he felt someone should be fully ""safe"" (i.e., 100% in Fixed Income), but I argued you have another 20+ years of life ahead of you - and you need some con",,False,False,0,self.investing,1ndxdal
Receiving gifted stock from Father from Grandmother passing away,ArtichokeOwn6685,9,0.67,23,2025-09-10 22:52:04,https://www.reddit.com/r/investing/comments/1ndxqsv/receiving_gifted_stock_from_father_from/,https://www.reddit.com/r/investing/comments/1ndxqsv/receiving_gifted_stock_from_father_from/,"I will be receiving a multi 6 figure gifted walmart stock within next month or so. My father is splitting up my grandmother's inheritance between himself and my brother and I equally. She passed in the beginning of August. Im aware of the step up cost basis my father will receive on the shares and believe I also receive same once he transfers them to me. My question is based on some research is if I sell soon, I will pay short-term gains on it versus holding 1 year after grandmother's death.

I ",,False,False,0,self.investing,1ndxqsv
"Daily General Discussion and Advice Thread - September 11, 2025",AutoModerator,3,1.0,33,2025-09-11 04:01:04,https://www.reddit.com/r/investing/comments/1ne2xrc/daily_general_discussion_and_advice_thread/,https://www.reddit.com/r/investing/comments/1ne2xrc/daily_general_discussion_and_advice_thread/,"Have a general question? Want to offer some commentary on markets? Maybe you would just like to throw out a neat fact that doesn't warrant a self post? Feel free to post here!

Please consider consulting our FAQ first - [https://www.reddit.com/r/investing/wiki/faq](https://www.reddit.com/r/investing/wiki/faq) And our [side bar](https://www.reddit.com/r/investing/about/sidebar) also has useful resources.

If you are new to investing - please refer to Wiki - [Getting Started](https://www.reddit.co",Daily Discussion,False,False,0,self.investing,1ne2xrc
IB fees ane commisions question,david_novey,1,0.67,2,2025-09-11 09:11:01,https://www.reddit.com/r/investing/comments/1ne8fj8/ib_fees_ane_commisions_question/,https://www.reddit.com/r/investing/comments/1ne8fj8/ib_fees_ane_commisions_question/,"Hello, I recently created a IB account and want to buy ETFs long term. Do I buy them with a market order like any share? If so why the fees are extremely high? 

If im trying to get 10 shares of an ETF for 136.90 EUR total and it asks me to have 145.03 EUR in ky account it seems too excessive. 9 EUR fees and commisions, thats too much.. I checked the commisions and fees for German exchanges and its closer to 1.25 EUR not 9 Euros. 

Maybe Im not getting something? ",,False,False,0,self.investing,1ne8fj8
"The lithium industry ushered in a major impact, and the market value of related mining companies shrank sharply",Sufficient_Metal2839,28,0.9,4,2025-09-10 14:49:16,https://www.reddit.com/r/investing/comments/1ndmtpr/the_lithium_industry_ushered_in_a_major_impact/,https://www.reddit.com/r/investing/comments/1ndmtpr/the_lithium_industry_ushered_in_a_major_impact/,"ALBJust in, a major update from the lithium industry:  
China’s CATL has restarted lithium mining operations in Ganzhou, Jiangxi.  
The mine accounts for about **8% of global lithium supply**.

This directly triggered a sharp drop in lithium prices, causing global lithium miners’ share prices to plunge.  
Australia’s mining sector lost approximately **AUD 8.4 billion in market value in one day**.  
Several major lithium mining stocks **fell by more than 10%**.

Investors are concerned that lithi",,False,False,0,self.investing,1ndmtpr
Do I get more Nvidia or Broadcom,Average_Texarican14,0,0.44,18,2025-09-11 13:55:10,https://www.reddit.com/r/investing/comments/1nefo78/do_i_get_more_nvidia_or_broadcom/,https://www.reddit.com/r/investing/comments/1nefo78/do_i_get_more_nvidia_or_broadcom/,"I’ll keep this super short and easy, I have been managing my portfolio for years now and have been on each for a good while now. Yet it is time I will stop more of my diversification and cut down on most I need. For the next 3-7 years should I invest more heavily (when it comes to it) on Nvidia or Broadcom?  ",,False,False,0,self.investing,1nefo78
"Flexible us stock trading hours, tried moomoo?",umwohnendta,7,0.73,7,2025-09-10 23:02:21,https://www.reddit.com/r/investing/comments/1ndxy18/flexible_us_stock_trading_hours_tried_moomoo/,https://www.reddit.com/r/investing/comments/1ndxy18/flexible_us_stock_trading_hours_tried_moomoo/,"Australian, Work keeps me busy, and I wish I had more time to trade in the U.S. market. the regular trading hours feel pretty limiting. I recently found out that moomoo supports 24/5 U.S. stock trading, which lets me manage my investments more flexibly. Has anyone here traded U.S. stocks on moomoo? How’s your experience?",,False,False,0,self.investing,1ndxy18
Does Anyone Have Insight on The Trade Desk?,PinPsychological82,21,0.84,10,2025-09-10 14:49:03,https://www.reddit.com/r/investing/comments/1ndmthq/does_anyone_have_insight_on_the_trade_desk/,https://www.reddit.com/r/investing/comments/1ndmthq/does_anyone_have_insight_on_the_trade_desk/,"The Trade Desk is an interesting stock. They are down 67% from ATH and fell 11% today due to a Morgan Stanley analyst downgrade and Netflix and Amazon inking an ad deal.

I looked into them a while ago and was interested in their approach to a cookie-less world with UID2. I stopped looking but saw that Google really pushed back on ending cookies and pretty much killed Privacy Sandbox.

I don’t know too much about TTD or what they do, so I’d love to hear from those who have knowledge of the stock",,False,False,0,self.investing,1ndmthq
"Do ""Basic Options Strategies"" (Covered Calls, CSPs, Wheel) Really Beat QQQ Long-Term?",Hack-Nerd-85,2,0.59,14,2025-09-10 22:39:35,https://www.reddit.com/r/investing/comments/1ndxhwm/do_basic_options_strategies_covered_calls_csps/,https://www.reddit.com/r/investing/comments/1ndxhwm/do_basic_options_strategies_covered_calls_csps/,"Hello everyone, 

I would like to hear some honest, no-holds-barred feedback from experienced and established traders.

My question is this: Over the course of 10+ years, do basic options strategies - specifically selling covered calls, cash-secured puts, or a wheel strategy - actually outperform growth-centric ETFs (i.e., QQQ)?

Everything I find online (especially on YouTube) seems to be very pro-options trading, but many of them that market themselves as coaches, typically are trying to sell ",,False,False,0,self.investing,1ndxhwm
Traditional IRA vs Roth - Do I need to backdoor as high income earner,ivanjay2050,4,0.67,15,2025-09-10 22:09:24,https://www.reddit.com/r/investing/comments/1ndwwhi/traditional_ira_vs_roth_do_i_need_to_backdoor_as/,https://www.reddit.com/r/investing/comments/1ndwwhi/traditional_ira_vs_roth_do_i_need_to_backdoor_as/,"I am a high income earner and after some other debates looking to possibly switch my 401(k) contributions to 100% pretax and take my estimated savings and start contributing to a traditional IRA (since I am over income limit for the Roth IRA).  As I think thats the next step in maximizing tax advantaged accounts for me....

  
Since I am over the income limit where I cannot take the tax deduction on the traditional IRA is there a reason I would need to backdoor Roth?  I am not sure I understand ",,False,False,0,self.investing,1ndwwhi
Meme stocks aside - what's your pick for 1 stock to hold and why? What's your bullish stock?,ImakeBADinvestmentsx,113,0.79,205,2025-09-10 01:57:28,https://www.reddit.com/r/investing/comments/1nd6a9b/meme_stocks_aside_whats_your_pick_for_1_stock_to/,https://www.reddit.com/r/investing/comments/1nd6a9b/meme_stocks_aside_whats_your_pick_for_1_stock_to/,"As the title.

What is the one, two or three, stock aside from meme, pump and dumps etc that you are the most bullish one. It could be sector based. Industry. Or even recent thematic.

For me. I can't see a world where $GOOGL doesn't win. The recent oracle earnings was a good indication of price action in the cloud space and possibilities for Google cloud to grow at crazy pace with its TpU advantage.

Sector would be cloud and infra. So $amzn, $googl $msft. Then neo clouds like $crwv ( coreweave",,False,False,0,self.investing,1nd6a9b
