title,author,score,upvote_ratio,num_comments,created_utc,url,permalink,selftext,flair,is_video,over_18,gilded,domain,post_id
"Daily General Discussion and Advice Thread - September 14, 2025",AutoModerator,3,0.81,1,2025-09-14 04:01:17,https://www.reddit.com/r/investing/comments/1nglevq/daily_general_discussion_and_advice_thread/,https://www.reddit.com/r/investing/comments/1nglevq/daily_general_discussion_and_advice_thread/,"Have a general question? Want to offer some commentary on markets? Maybe you would just like to throw out a neat fact that doesn't warrant a self post? Feel free to post here!

Please consider consulting our FAQ first - [https://www.reddit.com/r/investing/wiki/faq](https://www.reddit.com/r/investing/wiki/faq) And our [side bar](https://www.reddit.com/r/investing/about/sidebar) also has useful resources.

If you are new to investing - please refer to Wiki - [Getting Started](https://www.reddit.co",Daily Discussion,False,False,0,self.investing,1nglevq
'We are in a gigantic price bubble': Famed economist warns,Responsible_Lake_500,798,0.86,311,2025-09-13 09:09:30,https://www.reddit.com/r/investing/comments/1nfx3xq/we_are_in_a_gigantic_price_bubble_famed_economist/,https://www.reddit.com/r/investing/comments/1nfx3xq/we_are_in_a_gigantic_price_bubble_famed_economist/,"['We are in a gigantic price bubble'](https://www.aol.com/articles/gigantic-price-bubble-famed-economist-091501018.html)

  
The last few years have been great for my retirement.  Lots of money in index funds, domestic and overseas.  Some gold and crypto.  Where is a safe place to hide with the correction?",,False,False,0,self.investing,1nfx3xq
Will the market face a persistent drag as Boomers begin liquidating 401Ks through retirement?,paleselan1,10,0.6,55,2025-09-14 05:56:27,https://www.reddit.com/r/investing/comments/1ngn9vo/will_the_market_face_a_persistent_drag_as_boomers/,https://www.reddit.com/r/investing/comments/1ngn9vo/will_the_market_face_a_persistent_drag_as_boomers/,"I have heard that the average return of the S&amp;P over time is 8% annually.  However, never in our history have we had so much market wealth concentrated among middle to upper-class Boomers, who are going to liquidate their holdings as they go through retirement. This is further exacerbated by the polls showing that many Boomers don't intend to leave wealth for their children.

My question is: will this create a new semi-permanent drag on the market, given the sheer magnitude of the 401K withd",,False,False,0,self.investing,1ngn9vo
How does your family talk about money - open chats or total silence?,Novelty_Wealth,10,0.72,6,2025-09-14 02:06:56,https://www.reddit.com/r/investing/comments/1ngji5d/how_does_your_family_talk_about_money_open_chats/,https://www.reddit.com/r/investing/comments/1ngji5d/how_does_your_family_talk_about_money_open_chats/,"In a lot of our families, money talk can feel… tricky. Some households are super open like everyone knows each other’s salary and plans. Others treat it like a secret topic that never makes it to the dinner table.

For a lot of couples or adult kids with their parents, opening up about every little detail whether its income, savings, debts - can feel like a weird mix of relief and a tiny “uh-oh, what now?”  
And plenty of families just skip the talk altogether to keep things easy.

How’s it for ",,False,False,0,self.investing,1ngji5d
"I Just Turned 18 and I Received 10,000 dollars",Ok_Bread_2465,61,0.73,84,2025-09-13 14:45:10,https://www.reddit.com/r/investing/comments/1ng5dwa/i_just_turned_18_and_i_received_10000_dollars/,https://www.reddit.com/r/investing/comments/1ng5dwa/i_just_turned_18_and_i_received_10000_dollars/,"I turned 18 earlier this week and received a very generous gift from a family member, 10,000 dollars. So I currently have around 15,500 saved right now. What is the smartest thing to do with this money. I want it to grow, not just sit in my low interest bank account. I would appreciate any advice 🙏",,False,False,0,self.investing,1ng5dwa
Who is leading or well-positioned in commercial robotics?,National-Resident244,8,1.0,7,2025-09-14 03:19:36,https://www.reddit.com/r/investing/comments/1ngkqeg/who_is_leading_or_wellpositioned_in_commercial/,https://www.reddit.com/r/investing/comments/1ngkqeg/who_is_leading_or_wellpositioned_in_commercial/,"I keep hearing that robotics is expected to be the next big wave of technology.  
Which companies or organizations are currently leading the way, or at least in a strong position, in commercial robotics?

Also, are there any companies in this space that look especially interesting from an investment perspective right now?",,False,False,0,self.investing,1ngkqeg
"Stagflation Fears 2025: Low Growth High Inflation, Cost Challenges?",Narrow_Chance7639,4,0.67,0,2025-09-14 03:47:07,https://www.reddit.com/r/investing/comments/1ngl6kh/stagflation_fears_2025_low_growth_high_inflation/,https://www.reddit.com/r/investing/comments/1ngl6kh/stagflation_fears_2025_low_growth_high_inflation/,"Exploring economy trends without promo: Stagflation fears with 1.4% growth, 3.1% core inflation, Fed cuts loom but risks persist. Context: Debt suppression pressures businesses. What's a stagflation pain like rising costs? 

Leta discuss solutions for adaptation, and stay connected for more ongoing discussions. ",,False,False,0,self.investing,1ngl6kh
How do you research a stock?,doittodem,18,0.76,51,2025-09-13 18:52:51,https://www.reddit.com/r/investing/comments/1ngb73f/how_do_you_research_a_stock/,https://www.reddit.com/r/investing/comments/1ngb73f/how_do_you_research_a_stock/,"I basically get a summary from ChatGPT about history and what’s in the news. Then I look at motley fool to see insider trades and institutional ownership. I’m new to this so the financials, key metrics, overview and multiples only make a little sense to me as of yet.  I’ve heard to research a stock for a full day. I’m researching but I’d like to know how an experienced trader/ investor does this",,False,False,0,self.investing,1ngb73f
Increasing contributions not making much difference,NoRealName73,43,0.82,50,2025-09-13 11:37:16,https://www.reddit.com/r/investing/comments/1ng0l9k/increasing_contributions_not_making_much/,https://www.reddit.com/r/investing/comments/1ng0l9k/increasing_contributions_not_making_much/,"Hello All, 

I am 56 and have around $850k in my my 401k. I started a little late but have been pretty agressive over the last 15-20 years. I am currently contributing $825 a paycheck every 2 weeks so $21,450 a year. I also get a company match of about 5-6k a year. I am planning on retiring around 65. So I have less than 9 years left to invest with work. I've played with the numbers a little and it seems upping my contributions to $900 every paycheck does not really add much in 9 years. Even goi",,False,False,0,self.investing,1ng0l9k
Using a tiny margin amount and the maintenance keeps changing,RatinSweet,2,1.0,2,2025-09-13 21:00:10,https://www.reddit.com/r/investing/comments/1ngdv50/using_a_tiny_margin_amount_and_the_maintenance/,https://www.reddit.com/r/investing/comments/1ngdv50/using_a_tiny_margin_amount_and_the_maintenance/,"I have a big LEAP position on Robinhood which takes up most of my 230K portfolio. I am utilizing 1K in free margin from Gold via SGOV.

Portfolio value: 239458
Margin used: 1000
Margin maintenance: 238627

My question is that whenever my portfolio dips like 5K or so, my margin maintenance also drops 5K. Same if my portfolio goes up 5K. I’m not totally sure exactly how much of a dip will trigger a margin call. Why does my maintenance keep going down?

",,False,False,0,self.investing,1ngdv50
Is Oracle just SoftBank wearing a mask?,OverwroughtPraise,1202,0.97,95,2025-09-12 10:06:01,https://www.reddit.com/r/investing/comments/1nf46bi/is_oracle_just_softbank_wearing_a_mask/,https://www.reddit.com/r/investing/comments/1nf46bi/is_oracle_just_softbank_wearing_a_mask/,"Let me get this straight:

* Oracle announces $455B in RPOs through 2030, driving stock up 40% in a single day
* $300B of this (66%) depends on a single contract with OpenAI starting in 2027
* OpenAI's funding for this contract comes from SoftBank's $500B Stargate commitment
* SoftBank's total assets are $300B - meaning they'd need to liquidate their entire company just for the Oracle deal
* This is the same SoftBank that valued WeWork at $47B then watched it collapse, promised $108B for Vision ",,False,False,0,self.investing,1nf46bi
Why this algo doesn’t just YOLO one stock,pwaha_haha,0,0.25,2,2025-09-14 05:53:52,https://www.reddit.com/r/investing/comments/1ngn8dx/why_this_algo_doesnt_just_yolo_one_stock/,https://www.reddit.com/r/investing/comments/1ngn8dx/why_this_algo_doesnt_just_yolo_one_stock/," Backtest allocations included:
TQQQ (growth)

GLD (gold hedge)

TLT (bonds)

URA (uranium)

BTAL (hedge fund ETF)

Diversification helped balance risk while still delivering massive returns.
Do you think diversified algos are more reliable than single-asset ones?",,False,False,0,self.investing,1ngn8dx
Is it possible to roll a non-employer Roth IRA from a bank to another platform?,Star-Lord-123,0,0.5,6,2025-09-13 20:14:20,https://www.reddit.com/r/investing/comments/1ngcxz3/is_it_possible_to_roll_a_nonemployer_roth_ira/,https://www.reddit.com/r/investing/comments/1ngcxz3/is_it_possible_to_roll_a_nonemployer_roth_ira/,"Hi, years ago I set up a personal Roth IRA at a bank that has over the years changed hands many times.  There wasn't much in it, and while it has grown, I honestly had forgotten about it and it hasn't really done a lot.

I was thinking of moving it out of that bank and into another platform.  Is that possible?  Let's say from the bank to something like Charles Schwab or Fidelity or Vanguard.  Every time I search for info on this, the search results seem to think I'm trying to roll over an employ",,False,False,0,self.investing,1ngcxz3
Your sustainable fund might not be what you think it is,mohityadavx,7,0.71,9,2025-09-13 08:58:13,https://www.reddit.com/r/investing/comments/1nfwv0f/your_sustainable_fund_might_not_be_what_you_think/,https://www.reddit.com/r/investing/comments/1nfwv0f/your_sustainable_fund_might_not_be_what_you_think/,"A massive academic review of sustainable investing research uncovered something concerning: recent studies show many funds labeled as ""sustainable"" or ""ESG"" actually contain companies with significant ESG controversies.

The research analyzed nearly 1,000 papers spanning 35 years and found that while sustainable investing exploded after 2015, the methods for screening companies remain surprisingly primitive. Most research relies on backward-looking data rather than predictive analysis, and there",,False,False,0,self.investing,1nfwv0f
10k/year to property and 13k/year to 401k. Is that enough to retire?,TonyHawksRival,0,0.49,25,2025-09-13 19:29:18,https://www.reddit.com/r/investing/comments/1ngbzst/10kyear_to_property_and_13kyear_to_401k_is_that/,https://www.reddit.com/r/investing/comments/1ngbzst/10kyear_to_property_and_13kyear_to_401k_is_that/,"Im 31. so im investing 23K/year essentially. My networth is around 300k. Can i safely blow my entire paychecks on leasure (after bills/401k) and not save a dime going forward? I already have an emergency fund of about 100k in stocks. 

My breakdown is
100k in 401k
100k in property
100k in stocks
5k cash",,False,False,0,self.investing,1ngbzst
401k Advice: Traditional vs Roth Allocations,Micksar,0,0.38,8,2025-09-13 23:07:09,https://www.reddit.com/r/investing/comments/1nggcfw/401k_advice_traditional_vs_roth_allocations/,https://www.reddit.com/r/investing/comments/1nggcfw/401k_advice_traditional_vs_roth_allocations/,"I currently contribute 12% to a traditional 401k. Employer matches 4%.

I have a pay increase on the horizon and may use this as an opportunity to revise my contributions mixed between traditional and roth.

Any suggestions on how to balance a 12% contribution between the two? I’m in my early/mid 30s. Thinking of going 8% traditional and 4% roth or 10% traditional and 2% roth.

Thanks for any ideas.",,False,False,0,self.investing,1nggcfw
Diversifying investments for down payment,Honest-Tough-3647,3,0.8,6,2025-09-13 12:34:52,https://www.reddit.com/r/investing/comments/1ng21er/diversifying_investments_for_down_payment/,https://www.reddit.com/r/investing/comments/1ng21er/diversifying_investments_for_down_payment/,"I am saving for my first home, and I currently have about 81k in VTSAX. I plan to use most of it for a down payment in 3 to 4 years, around 120k, and I will be adding more as I go. Since the market feels highly valued, should I move some money into VBTLX to lower risk, since I will need the cash sooner? Or should I just keep it in VTSAX and not worry about timing the market? I am open to other strategies, too. I expect to save about 70k a year, so I should reach my goal either way, which makes m",,False,False,0,self.investing,1ng21er
Gold DCA at an all-time-high price,baron_quinn_02486,10,0.75,14,2025-09-13 06:08:56,https://www.reddit.com/r/investing/comments/1nftshh/gold_dca_at_an_alltimehigh_price/,https://www.reddit.com/r/investing/comments/1nftshh/gold_dca_at_an_alltimehigh_price/,"I’ve been dollar cost averaging into physical gold through an auto-invest plan with Summit Metals for a while now. A fixed amount is deducted monthly and accumulated until it buys a full ounce, which is then shipped to me. But with gold hitting all-time highs, I’m rethinking my strategy.

I’m always tempted to dial my monthly amount down as the price rises, effectively buying fewer ounces over time. However, this feels like market timing based on intuition, which goes against the set-and-forget ",,False,False,0,self.investing,1nftshh
I am turning 18 in January and I wanna start investing early,Immediate_Kick_6167,28,0.83,63,2025-09-12 22:35:15,https://www.reddit.com/r/investing/comments/1nfm4b7/i_am_turning_18_in_january_and_i_wanna_start/,https://www.reddit.com/r/investing/comments/1nfm4b7/i_am_turning_18_in_january_and_i_wanna_start/,"I turn 18 in January and I don’t really know much about investing, so that’s why I’m here

I know that investing isn’t the truly fastest way to make money, but I don’t really wanna risk all my money on get rich quick (like day trading, that’s too risky for me). I plan on starting an account on MooMoo because I heard that’s a solid place to begin but I don’t understand the market and I’m here for that reason

What would you guys say would be the safest place to keep my money when it comes to inve",,False,False,0,self.investing,1nfm4b7
Where could I backtest my hypothesis on a longer time horizon?,BlightedErgot32,0,0.5,1,2025-09-13 16:15:20,https://www.reddit.com/r/investing/comments/1ng7ksg/where_could_i_backtest_my_hypothesis_on_a_longer/,https://www.reddit.com/r/investing/comments/1ng7ksg/where_could_i_backtest_my_hypothesis_on_a_longer/,"Simply put, my hypothesis is that a growth fund + a dividend growth fund will outperform the general market…

say VIG + VUG versus VTI.

or VIGI + VXUS (no cheap international growth fund)

I wanna test both + the combination of the two.

I have used Testfolio :

US Equity [20 years] : https://testfol.io/?s=a5S57NUaJYd

exUS Equity [10 years] : https://testfol.io/?s=2FXz0OrqzZa

and so a combination of the two would be limited by the lowest common denominator (10 years) and 20 years isnt enough ",,False,False,0,self.investing,1ng7ksg
How should I use my Charles Schwab account if most of my investments are with Fidelity?,kidbehumble,0,0.5,35,2025-09-13 15:15:00,https://www.reddit.com/r/investing/comments/1ng64tz/how_should_i_use_my_charles_schwab_account_if/,https://www.reddit.com/r/investing/comments/1ng64tz/how_should_i_use_my_charles_schwab_account_if/,"Hello everyone, I’m just looking for a bit of advice. I currently have two investment accounts, one with Fidelity and one with Charles Schwab. The majority of my investments are with Fidelity, but I don’t really want to close my Schwab account. For those who are in a similar situation, how do you decide what to use the secondary brokerage for? Should I maybe use CS for individual stock investing since I don’t really have any with Fidelity or should I use it for something else? Also, if you have ",,False,False,0,self.investing,1ng64tz
Daily Yahoo Finance articles on IBM,BudTugglie,0,0.4,2,2025-09-13 15:04:44,https://www.reddit.com/r/investing/comments/1ng5vv7/daily_yahoo_finance_articles_on_ibm/,https://www.reddit.com/r/investing/comments/1ng5vv7/daily_yahoo_finance_articles_on_ibm/,"I get an RSS feed from Yahoo Finance.  Usually only a dozen articles per day or less.  Every day for the last month or more, Yahoo has at least one finance article focused on IBM.  

Very strange to see IBM mentioned every day.  Is there some reason that Yahoo is so actively promoting IBM?",,False,False,0,self.investing,1ng5vv7
To invest or to spend it on myself?,udaretouchmyspaghett,0,0.33,23,2025-09-13 21:24:41,https://www.reddit.com/r/investing/comments/1ngecxh/to_invest_or_to_spend_it_on_myself/,https://www.reddit.com/r/investing/comments/1ngecxh/to_invest_or_to_spend_it_on_myself/,"I (19M) was wondering if i should still invest or just spend it on myself. For some background information, I am currently in mandatory national service and my pay each month is roughly 750. I have been putting most of my monthly pay into investing the past 4 months (around 2k).

However, would it even be worth it to continue investing with such a small capital? It is a good learning experience and I have been up 16% so far. That said, I think I have been spending quite a bit of effort researchi",,False,False,0,self.investing,1ngecxh
Trying to understand Li Auto stock (why it hasn't gone down more),Sn0wDazzle,0,0.25,0,2025-09-13 17:16:29,https://www.reddit.com/r/investing/comments/1ng907k/trying_to_understand_li_auto_stock_why_it_hasnt/,https://www.reddit.com/r/investing/comments/1ng907k/trying_to_understand_li_auto_stock_why_it_hasnt/,"Li Auto has had, what looks to me, a terrible trend the past several months. August deliveries were \~40 % down YoY. 2nd quarter results were not as bad as that, but still nothing good. The deliveries for Q2 were only \~2% higher YoY. 4.5 % declined revenue, net income essentially flat.

However, they guided for Q3 deliveries and revenue to decline \~40% YoY!

[https://cnevpost.com/2025/08/28/li-auto-q2-2025-earnings/](https://cnevpost.com/2025/08/28/li-auto-q2-2025-earnings/)

Finally, their up",,False,False,0,self.investing,1ng907k
Llyod Blankfein 100% in equities,SuperNewk,20,0.67,48,2025-09-12 20:43:58,https://www.reddit.com/r/investing/comments/1nfjvtn/llyod_blankfein_100_in_equities/,https://www.reddit.com/r/investing/comments/1nfjvtn/llyod_blankfein_100_in_equities/,"per his CNBC interview on the same thesis as everyone else.

Interest rates are lowering = you can gamble risk free 


First lowering cycle in my lifetime when everyone realizes stocks will go up.  We are going to see some incredible numbers in the next week/months.

Then EOY Santa rally for more fuel on fire, this could be the biggest gaining year in history of S&amp;P",,False,False,0,self.investing,1nfjvtn
Question on Currency Hedged ETFs or Mutual Funds,Mirabolis,1,0.67,6,2025-09-13 12:11:42,https://www.reddit.com/r/investing/comments/1ng1gl8/question_on_currency_hedged_etfs_or_mutual_funds/,https://www.reddit.com/r/investing/comments/1ng1gl8/question_on_currency_hedged_etfs_or_mutual_funds/,"In an environment where the value of the US dollar has been going down and there is the potential for it to be further devalued, I realized I had no idea how the currency hedges done by hedged international stock and bond funds would work for US investors.

Over the last few decades where the assumption was generally “dollar strong, don’t want foreign currencies dropping to eat the returns of dollars invested internationally” those hedges were essentially a form of downside insurance for exchang",,False,False,0,self.investing,1ng1gl8
401k - Looking for BTC Exposure,Still_Set_7485,0,0.29,7,2025-09-13 22:14:06,https://www.reddit.com/r/investing/comments/1ngfc8u/401k_looking_for_btc_exposure/,https://www.reddit.com/r/investing/comments/1ngfc8u/401k_looking_for_btc_exposure/,"I am 46 and am and have been contributing to a 401k. I do not have any options with the provider to access BTC directly or through direct selections of BTC ETFs or BTC Treasury companies. 

What options do I have if I want to direct some of this capital to BTC? ",,False,False,0,self.investing,1ngfc8u
32M looking for advice on current holdings,giannellaant,0,0.17,12,2025-09-13 17:11:42,https://www.reddit.com/r/investing/comments/1ng8wac/32m_looking_for_advice_on_current_holdings/,https://www.reddit.com/r/investing/comments/1ng8wac/32m_looking_for_advice_on_current_holdings/,"Started investing at 28. My current holdings include: 

Roth IRA: 100% VT 
Employer Simple IRA: 100% SPIAX 
HSA: 100% FZROX
Brokerage: SOFI, HIMS, NVO, VTI 

I know holding both VT and VTI may be redundant, but I was thinking that having VTI in my brokerage will give me some more US exposure. 
",,False,False,0,self.investing,1ng8wac
"Daily General Discussion and Advice Thread - September 13, 2025",AutoModerator,3,1.0,15,2025-09-13 04:00:52,https://www.reddit.com/r/investing/comments/1nfrsx5/daily_general_discussion_and_advice_thread/,https://www.reddit.com/r/investing/comments/1nfrsx5/daily_general_discussion_and_advice_thread/,"Have a general question? Want to offer some commentary on markets? Maybe you would just like to throw out a neat fact that doesn't warrant a self post? Feel free to post here!

Please consider consulting our FAQ first - [https://www.reddit.com/r/investing/wiki/faq](https://www.reddit.com/r/investing/wiki/faq) And our [side bar](https://www.reddit.com/r/investing/about/sidebar) also has useful resources.

If you are new to investing - please refer to Wiki - [Getting Started](https://www.reddit.co",Daily Discussion,False,False,0,self.investing,1nfrsx5
Value play ATCH in financial infrastructure,millionaire_vietname,3,0.8,3,2025-09-13 03:17:02,https://www.reddit.com/r/investing/comments/1nfr3ur/value_play_atch_in_financial_infrastructure/,https://www.reddit.com/r/investing/comments/1nfr3ur/value_play_atch_in_financial_infrastructure/,"AtlasClear (ATCH) went public through a SPAC in 2023 and got dumped into penny stock land. But things are changing fast:
	•	Their broker-dealer (Wilson-Davis) just posted $1.48M net income, that’s +295% YoY. Revenue $12.9M, up double digits. They’re actually printing profit.
	•	At the parent level, revenue basically doubled YoY and margins are fat (74%+).
	•	They cleaned up the balance sheet with a $45M financing in July. Even talking about a $5M share buyback.

Upcoming catalysts: 10-K form
Rel",,False,False,0,self.investing,1nfr3ur
AMZN covered calls free money?!,Historical_Air_8997,0,0.33,15,2025-09-13 18:25:40,https://www.reddit.com/r/investing/comments/1ngal7f/amzn_covered_calls_free_money/,https://www.reddit.com/r/investing/comments/1ngal7f/amzn_covered_calls_free_money/,"We have some vested AMZN RSUs that have been pretty stagnant but I’m bullish on the company and we’re plenty diversified so we’re holding. 




About a month ago I was reading some covered call strategies and AMZN stood out as a decent company to sell covered calls on. So I tried it weekly for the last month, on Friday I’d sell a CC for the next Friday from $130-248 each. After rolling the cost and putting aside some money for the tax man I came out with about $440. That’s just under 2% return f",,False,False,0,self.investing,1ngal7f
Thoughts on the RDDT stock?,RelationshipNo556,22,0.65,98,2025-09-12 13:33:43,https://www.reddit.com/r/investing/comments/1nf9hkw/thoughts_on_the_rddt_stock/,https://www.reddit.com/r/investing/comments/1nf9hkw/thoughts_on_the_rddt_stock/,"I'm curious to know what other people think about it. I bought almost ten shares of it when it first came out in 2024 at 34/share, and now it's up to mid-250s.  Do you think it has potential for substantial long-term growth? Or will it be a victim of the eventual AI bubble burst? (I do think it is coming)",,False,False,0,self.investing,1nf9hkw
"Stocks at a discount, with strong financials",riisenshadow92,4,0.56,32,2025-09-12 20:29:17,https://www.reddit.com/r/investing/comments/1nfjkvq/stocks_at_a_discount_with_strong_financials/,https://www.reddit.com/r/investing/comments/1nfjkvq/stocks_at_a_discount_with_strong_financials/,"Hi,
Built a reserve that I really want to invest, looking to see suggestions for stocks to look into that are being slept on.

One in particular is ISRG, they build surgical robotics systems, profitable with growing revenue year over year, and they don’t just sell the products, once the product is installed a vast majority of revenue after comes from up sells and services (knifes, tech support) 

Looking for over recommendations, specially ones with long term growth potential that other investor",,False,False,0,self.investing,1nfjkvq
