title,author,score,upvote_ratio,num_comments,created_utc,url,permalink,selftext,flair,is_video,over_18,gilded,domain,post_id
Everything is at its peak?,Possible_Ad_3273,260,0.81,265,2025-09-09 20:02:17,https://www.reddit.com/r/investing/comments/1nczc7o/everything_is_at_its_peak/,https://www.reddit.com/r/investing/comments/1nczc7o/everything_is_at_its_peak/,"Am I missing anything or is everything wildly high right now? Nasdaq stocks are super high, s&amp;p500 is super high, gold is super high, Bitcoin is super high. How are we supposed to hedge against a drop if everything is white hot? I guess keeping more in cash but that feels like a waste, surely there's something undervalued right now?",,False,False,0,self.investing,1nczc7o
So what is the deal with gold?,unvirginate,0,0.26,36,2025-09-11 14:59:31,https://www.reddit.com/r/investing/comments/1nehcu0/so_what_is_the_deal_with_gold/,https://www.reddit.com/r/investing/comments/1nehcu0/so_what_is_the_deal_with_gold/,"I’m sitting on a Costco gold bar that I got for 2.7k last year. I didn’t buy it as an investment, I bought it only because my MIL told me to, so I did just out of respect. Indian family by the way. Gold is a sentiment in India, in case you weren’t aware.

Not sure I understand how it has appreciated by 30% till date. 

Chat, is the civilization about to collapse? I don’t think I’ve seen a parabolic gold price chart before. 

I see a lot of reports that say the gold will touch 5k in the next year",,False,False,0,self.investing,1nehcu0
